NUM_STUDENTS, 700
FIRST_NAME, LAST_NAME, HR_TEACH, FIRST_PERIOD, STUDENT_ID, GRADE, SEL1_ID, SEL1_TEACH, SEL2_ID, SEL2_TEACH, SEL3_ID, SEL3_TEACH, SEL4_ID, SEL4_TEACH
SYDNEY, Txxx, N/A, RAHEB, 123420, 12, 2, TeacherSession2, 34, TeacherSession34, 1, TeacherSession1, 19, TeacherSession19
ADDYSON, Lxxxxxxx, N/A, RAMOS, 153733, 12, 2, TeacherSession2, 42, TeacherSession42, 1, TeacherSession1, 14, TeacherSession14
MYKAELA, Bxxxx, N/A, PIETRZAK, 121501, 12, 34, TeacherSession34, 19, TeacherSession19, 28, TeacherSession28, 31, TeacherSession31
SASHA, Gxxxxx, N/A, RICHARDSON, 176973, 12, 46, TeacherSession46, 37, TeacherSession37, 28, TeacherSession28, 22, TeacherSession22
ALEX, Pxxxxx, N/A, STATON, 183402, 12, 13, TeacherSession13, 11, TeacherSession11, 7, TeacherSession7, 9, TeacherSession9
CAMDEN, Gxxxxxx, N/A, RICHARDSON, 136333, 12, 22, TeacherSession22, 19, TeacherSession19, 43, TeacherSession43, 34, TeacherSession34
TRENTON, Txxxxx, N/A, RAHEB, 194117, 12, 34, TeacherSession34, 19, TeacherSession19, 23, TeacherSession23, 22, TeacherSession22
CHRIS, Rxxxxxxx, N/A, STATON, 197462, 12, 10, TeacherSession10, 9, TeacherSession9, 13, TeacherSession13, 11, TeacherSession11
KATHERINE, Sxxxxxx, N/A, STATON, 120243, 12, 46, TeacherSession46, 37, TeacherSession37, 28, TeacherSession28, 30, TeacherSession30
RANIA, Sxxxx, N/A, STATON, 106888, 12, 7, TeacherSession7, 5, TeacherSession5, 10, TeacherSession10, 19, TeacherSession19
AVERY, Axxxxxxxx, N/A, PIETRZAK, 159613, 12, 43, TeacherSession43, 42, TeacherSession42, 20, TeacherSession20, 26, TeacherSession26
MASON, Txxxx, N/A, GREGOR, 117440, 12, 16, TeacherSession16, 3, TeacherSession3, 1, TeacherSession1, 18, TeacherSession18
CAMERON, Cxxxxxx, N/A, STATON, 100208, 12, 38, TeacherSession38, 39, TeacherSession39, 40, TeacherSession40, 35, TeacherSession35
DEVIN, Hxxxx, N/A, RICHARDSON, 116245, 12, 16, TeacherSession16, 15, TeacherSession15, 42, TeacherSession42, 5, TeacherSession5
JOSHUA, Vxxxxxxxxxxx, N/A, GREGOR, 167734, 12, 18, TeacherSession18, 36, TeacherSession36, 4, TeacherSession4, 27, TeacherSession27
TREY, Hxxxxx, N/A, RICHARDSON, 150988, 12, 4, TeacherSession4, 19, TeacherSession19, 13, TeacherSession13, 42, TeacherSession42
JUSTIN, Txxxxx, N/A, GREGOR, 197878, 12, 9, TeacherSession9, 5, TeacherSession5, 19, TeacherSession19, 10, TeacherSession10
KRISH, Pxxxx, N/A, GREGOR, 136406, 12, 19, TeacherSession19, 3, TeacherSession3, 16, TeacherSession16, 17, TeacherSession17
SHREEJI, Pxxxxxx, N/A, GREGOR, 174804, 12, 19, TeacherSession19, 3, TeacherSession3, 16, TeacherSession16, 17, TeacherSession17
ALLEN, Nxxx, N/A, PIETRZAK, 189308, 12, 9, TeacherSession9, 5, TeacherSession5, 7, TeacherSession7, 10, TeacherSession10
ANASTASIA, Wxxxxx, N/A, GREGOR, 134639, 12, 44, TeacherSession44, 9, TeacherSession9, 6, TeacherSession6, 42, TeacherSession42
CARTER, Nxxxxx, N/A, RAMOS, 154084, 12, 6, TeacherSession6, 7, TeacherSession7, 41, TeacherSession41, 37, TeacherSession37
AUBREY, Rxxxxx, N/A, GREGOR, 164172, 12, 44, TeacherSession44, 9, TeacherSession9, 6, TeacherSession6, 42, TeacherSession42
BERLIN, Bxxxxxxxxxx, N/A, PIETRZAK, 154319, 12, 42, TeacherSession42, 19, TeacherSession19, 16, TeacherSession16, 43, TeacherSession43
ALEC, Lxxxxx, N/A, RICHARDSON, 184046, 12, 39, TeacherSession39, 40, TeacherSession40, 38, TeacherSession38, 22, TeacherSession22
TY, Vxxxxxxx, N/A, RAHEB, 138124, 12, 27, TeacherSession27, 20, TeacherSession20, 24, TeacherSession24, 8, TeacherSession8
EVELYN, Lxxxx, N/A, GREGOR, 139122, 12, 46, TeacherSession46, 5, TeacherSession5, 38, TeacherSession38, 40, TeacherSession40
EDREES, Sxxxxx, N/A, PIETRZAK, 156233, 12, 37, TeacherSession37, 30, TeacherSession30, 41, TeacherSession41, 46, TeacherSession46
ABIGAIL, Wxxx, N/A, GREGOR, 196885, 12, 37, TeacherSession37, 29, TeacherSession29, 28, TeacherSession28, 32, TeacherSession32
YOGI, Pxxxx, N/A, NERY, 133700, 12, 28, TeacherSession28, 30, TeacherSession30, 33, TeacherSession33, 32, TeacherSession32
SCARLETT, Exxxxxxxxxxx, N/A, FINCH, 134353, 12, 42, TeacherSession42, 19, TeacherSession19, 45, TeacherSession45, 2, TeacherSession2
JALAYA, Kxxx, N/A, RICHARDSON, 110918, 12, 44, TeacherSession44, 34, TeacherSession34, 41, TeacherSession41, 40, TeacherSession40
KATHEIRNE, Axxxxxxx, N/A, RICHARDSON, 160166, 12, 18, TeacherSession18, 15, TeacherSession15, 14, TeacherSession14, 23, TeacherSession23
YASSIR, Hxxxxxx, N/A, RICHARDSON, 146706, 12, 19, TeacherSession19, 29, TeacherSession29, 37, TeacherSession37, 41, TeacherSession41
ANA SOPHIA, Bxxxxxxxxx xxxxx, N/A, FINCH, 190254, 12, 5, TeacherSession5, 2, TeacherSession2, 36, TeacherSession36, 45, TeacherSession45
ALLISON, Gxxxxxx, N/A, RAMOS, 131053, 12, 31, TeacherSession31, 44, TeacherSession44, 34, TeacherSession34, 22, TeacherSession22
NICHOLAS, Mxxxx, N/A, RAMOS, 117600, 12, 5, TeacherSession5, 10, TeacherSession10, 8, TeacherSession8, 9, TeacherSession9
SUHINA, Mxxxx, N/A, RAMOS, 139190, 12, 46, TeacherSession46, 2, TeacherSession2, 37, TeacherSession37, 19, TeacherSession19
JONATHAN, Sxxxxxx, N/A, RAHEB, 159967, 12, 16, TeacherSession16, 7, TeacherSession7, 5, TeacherSession5, 27, TeacherSession27
HUNAH, Qxxxxx, N/A, PIETRZAK, 108355, 12, 29, TeacherSession29, 35, TeacherSession35, 37, TeacherSession37, 46, TeacherSession46
JAMES, Lxx, N/A, NERY, 164517, 12, 13, TeacherSession13, 9, TeacherSession9, 10, TeacherSession10, 46, TeacherSession46
TRE, Lxxxxxxx, N/A, RAMOS, 102860, 12, 5, TeacherSession5, 13, TeacherSession13, 12, TeacherSession12, 46, TeacherSession46
JULIANA, Jxxxxxx, N/A, RAMOS, 141663, 12, 14, TeacherSession14, 15, TeacherSession15, 27, TeacherSession27, 26, TeacherSession26
AUDREY, Sxxxxxxxxx, N/A, PIETRZAK, 172574, 12, 19, TeacherSession19, 44, TeacherSession44, 37, TeacherSession37, 35, TeacherSession35
FINNEGAN, Bxxxxxx, N/A, PIETRZAK, 123132, 12, 36, TeacherSession36, 15, TeacherSession15, 13, TeacherSession13, 6, TeacherSession6
DYLAN, Gxxxxxx, N/A, RICHARDSON, 123554, 12, 13, TeacherSession13, 12, TeacherSession12, 11, TeacherSession11, 10, TeacherSession10
ARABELLA, Bxxxxxx, N/A, PIETRZAK, 144997, 12, 4, TeacherSession4, 14, TeacherSession14, 19, TeacherSession19, 26, TeacherSession26
ORSONSOL, Mxxxxxxxxxx, N/A, NERY, 194353, 12, 10, TeacherSession10, 13, TeacherSession13, 11, TeacherSession11, 9, TeacherSession9
THOMAS, Fxxxxxxxxx, N/A, RICHARDSON, 198555, 12, 1, TeacherSession1, 4, TeacherSession4, 2, TeacherSession2, 7, TeacherSession7
AARAV, Pxxxxxx, N/A, NERY, 131192, 12, 39, TeacherSession39, 43, TeacherSession43, 13, TeacherSession13, 14, TeacherSession14
MATTHEW, Txxxxx, N/A, RAHEB, 155054, 12, 15, TeacherSession15, 34, TeacherSession34, 45, TeacherSession45, 46, TeacherSession46
JUNE, Gxxxxxxx, N/A, FINCH, 163416, 12, 36, TeacherSession36, 42, TeacherSession42, 4, TeacherSession4, 45, TeacherSession45
COLIN, Gxxx, N/A, NERY, 127182, 12, 37, TeacherSession37, 29, TeacherSession29, 9, TeacherSession9, 44, TeacherSession44
TRISTAN, Hxxxxxx, N/A, RICHARDSON, 178055, 12, 12, TeacherSession12, 5, TeacherSession5, 13, TeacherSession13, 22, TeacherSession22
ELENA, Wxxxx, N/A, RAHEB, 192605, 12, 44, TeacherSession44, 36, TeacherSession36, 2, TeacherSession2, 46, TeacherSession46
EMMA, Wxxxxxx, N/A, RAHEB, 108886, 12, 44, TeacherSession44, 31, TeacherSession31, 22, TeacherSession22, 45, TeacherSession45
SYDNEY, Cxxxxx, N/A, STATON, 101842, 12, 33, TeacherSession33, 37, TeacherSession37, 46, TeacherSession46, 42, TeacherSession42
TANISHA, Bxxxxxxxx, N/A, FINCH, 193680, 12, 37, TeacherSession37, 46, TeacherSession46, 41, TeacherSession41, 17, TeacherSession17
COLE, Mxxxxxxx, N/A, NERY, 180511, 12, 19, TeacherSession19, 22, TeacherSession22, 28, TeacherSession28, 45, TeacherSession45
CHRISTIAN, Dx xxxx, N/A, STATON, 116949, 12, 19, TeacherSession19, 14, TeacherSession14, 6, TeacherSession6, 45, TeacherSession45
SIERA, Cxxx, N/A, FINCH, 155538, 12, 14, TeacherSession14, 15, TeacherSession15, 2, TeacherSession2, 44, TeacherSession44
ADRIAN, Mxxxxxxx, N/A, NERY, 197023, 12, 46, TeacherSession46, 37, TeacherSession37, 34, TeacherSession34, 33, TeacherSession33
REBECCA, Lxxxxxx, N/A, NERY, 169781, 12, 28, TeacherSession28, 17, TeacherSession17, 46, TeacherSession46, 45, TeacherSession45
KESIREDDY, Sxxxxxx, N/A, FINCH, 125876, 12, 13, TeacherSession13, 5, TeacherSession5, 7, TeacherSession7, 3, TeacherSession3
REESE, Axxxxxxxx, N/A, FINCH, 132432, 12, 1, TeacherSession1, 25, TeacherSession25, 19, TeacherSession19, 22, TeacherSession22
TEYMUR, Axxxxxx, N/A, FINCH, 139476, 12, 15, TeacherSession15, 29, TeacherSession29, 5, TeacherSession5, 9, TeacherSession9
DEUCE, Vxxxxxxxxx, N/A, KHLYABICH, 166076, 12, 15, TeacherSession15, 16, TeacherSession16, 17, TeacherSession17, 21, TeacherSession21
MARIAM, Hxxxxx, N/A, RICHARDSON, 199979, 12, 35, TeacherSession35, 46, TeacherSession46, 26, TeacherSession26, 44, TeacherSession44
AVA, Fxxxxx, N/A, DASILVA, 185020, 11, 41, TeacherSession41, 42, TeacherSession42, 43, TeacherSession43, 31, TeacherSession31
MEGHANA, Gxxxxx, N/A, G BRAMLETT, 186681, 11, 10, TeacherSession10, 38, TeacherSession38, 40, TeacherSession40, 11, TeacherSession11
SOLOMON, Hxx, N/A, DASILVA, 179819, 11, 10, TeacherSession10, 9, TeacherSession9, 1, TeacherSession1, 11, TeacherSession11
JUDE, Rxxxxxxxxx, N/A, G BRAMLETT, 180684, 11, 19, TeacherSession19, 2, TeacherSession2, 16, TeacherSession16, 44, TeacherSession44
RYLEIGH, Dxxxxxx, N/A, DASILVA, 131358, 11, 1, TeacherSession1, 23, TeacherSession23, 34, TeacherSession34, 19, TeacherSession19
CARTER, Bxxxxxx, N/A, DASILVA, 156112, 11, 8, TeacherSession8, 13, TeacherSession13, 17, TeacherSession17, 19, TeacherSession19
ALEXANDRA, Bxxxx, N/A, SNIVELY, 136517, 11, 41, TeacherSession41, 32, TeacherSession32, 30, TeacherSession30, 28, TeacherSession28
ADAM, Exxxxxxxx, N/A, G BRAMLETT, 147611, 11, 4, TeacherSession4, 12, TeacherSession12, 35, TeacherSession35, 36, TeacherSession36
ROBERT, Sxxxxxxx, N/A, G BRAMLETT, 196655, 11, 30, TeacherSession30, 37, TeacherSession37, 36, TeacherSession36, 35, TeacherSession35
BENJAMIN, Pxxxxxxxx, N/A, G BRAMLETT, 114724, 11, 30, TeacherSession30, 37, TeacherSession37, 36, TeacherSession36, 44, TeacherSession44
MAXWELL, Fxxxx, N/A, DASILVA, 187971, 11, 9, TeacherSession9, 8, TeacherSession8, 10, TeacherSession10, 11, TeacherSession11
AMY, Bxxxxxxxxx, N/A, DASILVA, 123855, 11, 41, TeacherSession41, 12, TeacherSession12, 35, TeacherSession35, 19, TeacherSession19
PLEASANT, Lxxxx, N/A, B GLEZEN, 173645, 11, 19, TeacherSession19, 27, TeacherSession27, 38, TeacherSession38, 10, TeacherSession10
SKYLER, Cxxxx, N/A, SNIVELY, 194328, 11, 37, TeacherSession37, 35, TeacherSession35, 34, TeacherSession34, 33, TeacherSession33
JACK, Gxxxxxxx, N/A, DASILVA, 128052, 11, 29, TeacherSession29, 18, TeacherSession18, 41, TeacherSession41, 34, TeacherSession34
BOSTON, Bxxxxxx, N/A, DASILVA, 143191, 11, 4, TeacherSession4, 33, TeacherSession33, 19, TeacherSession19, 37, TeacherSession37
CHRISTOPHER, Exxxxxx, N/A, DASILVA, 102092, 11, 41, TeacherSession41, 42, TeacherSession42, 9, TeacherSession9, 24, TeacherSession24
ARYAN, Axxxx, N/A, DASILVA, 184785, 11, 11, TeacherSession11, 41, TeacherSession41, 8, TeacherSession8, 7, TeacherSession7
JACK, Cxxxxx, N/A, SNIVELY, 167925, 11, 38, TeacherSession38, 42, TeacherSession42, 23, TeacherSession23, 22, TeacherSession22
THOMAS, Bxxxx, N/A, SNIVELY, 192088, 11, 9, TeacherSession9, 10, TeacherSession10, 41, TeacherSession41, 3, TeacherSession3
TRAVIS, Dxxxx, N/A, SNIVELY, 168523, 11, 38, TeacherSession38, 13, TeacherSession13, 23, TeacherSession23, 8, TeacherSession8
NADINE, Sxxxxx, N/A, G BRAMLETT, 195155, 11, 33, TeacherSession33, 29, TeacherSession29, 15, TeacherSession15, 44, TeacherSession44
ABBEY, Bxxxxxx, N/A, SNIVELY, 128149, 11, 46, TeacherSession46, 19, TeacherSession19, 28, TeacherSession28, 1, TeacherSession1
MICHAEL, Cxxxxxx, N/A, SNIVELY, 188418, 11, 38, TeacherSession38, 42, TeacherSession42, 23, TeacherSession23, 22, TeacherSession22
CAMRYN, Sxxxxxxx, N/A, G BRAMLETT, 167996, 11, 1, TeacherSession1, 22, TeacherSession22, 6, TeacherSession6, 42, TeacherSession42
JAYDEN, Cxxxxxx, N/A, SNIVELY, 112323, 11, 38, TeacherSession38, 42, TeacherSession42, 23, TeacherSession23, 22, TeacherSession22
ANDREW, Fxxxxxxx, N/A, SNIVELY, 108057, 11, 39, TeacherSession39, 10, TeacherSession10, 13, TeacherSession13, 11, TeacherSession11
PEYTON, Sxxxxxx, N/A, G BRAMLETT, 176191, 11, 18, TeacherSession18, 42, TeacherSession42, 19, TeacherSession19, 41, TeacherSession41
SOLARIS, Cxxxx, N/A, SNIVELY, 100753, 11, 13, TeacherSession13, 10, TeacherSession10, 5, TeacherSession5, 18, TeacherSession18
AASHISH, Axxxxxxx, N/A, SNIVELY, 182757, 11, 9, TeacherSession9, 10, TeacherSession10, 38, TeacherSession38, 5, TeacherSession5
NICHOLAS, Bxxx, N/A, G BRAMLETT, 135730, 11, 9, TeacherSession9, 10, TeacherSession10, 38, TeacherSession38, 40, TeacherSession40
CAELEN, Gxxxxx, N/A, B GLEZEN, 122420, 11, 27, TeacherSession27, 18, TeacherSession18, 14, TeacherSession14, 17, TeacherSession17
ALINA, Sxxxxxx, N/A, JERDON, 163520, 11, 46, TeacherSession46, 37, TeacherSession37, 45, TeacherSession45, 21, TeacherSession21
CHRISTIAN, Txxxx, N/A, PITTENGER, 154109, 11, 43, TeacherSession43, 21, TeacherSession21, 40, TeacherSession40, 44, TeacherSession44
JACOB, Fxxx, N/A, ORTON, 188767, 11, 1, TeacherSession1, 22, TeacherSession22, 19, TeacherSession19, 27, TeacherSession27
NATALIA, Mxxxxxx, N/A, G BRAMLETT, 161428, 11, 41, TeacherSession41, 33, TeacherSession33, 43, TeacherSession43, 19, TeacherSession19
CASSIDY, Cxxxx, N/A, SNIVELY, 173064, 11, 1, TeacherSession1, 41, TeacherSession41, 2, TeacherSession2, 4, TeacherSession4
MANAN, Jxxx, N/A, PITTENGER, 139290, 11, 41, TeacherSession41, 10, TeacherSession10, 37, TeacherSession37, 8, TeacherSession8
ANDY, Gxxx, N/A, PITTENGER, 163177, 11, 41, TeacherSession41, 10, TeacherSession10, 37, TeacherSession37, 8, TeacherSession8
HRYDAY, Pxxxx, N/A, JERDON, 104742, 11, 10, TeacherSession10, 1, TeacherSession1, 16, TeacherSession16, 15, TeacherSession15
NEJHAE, Cxxxx, N/A, B GLEZEN, 193759, 11, 42, TeacherSession42, 38, TeacherSession38, 21, TeacherSession21, 17, TeacherSession17
FRANCIS, Lxxxxxxxxxx, N/A, B GLEZEN, 140312, 11, 34, TeacherSession34, 21, TeacherSession21, 1, TeacherSession1, 15, TeacherSession15
EHAB, Exxxxxxx, N/A, B GLEZEN, 187596, 11, 29, TeacherSession29, 37, TeacherSession37, 13, TeacherSession13, 19, TeacherSession19
EVANGELINE, Sxxxxx, N/A, GEOFFREY, 188599, 11, 34, TeacherSession34, 37, TeacherSession37, 46, TeacherSession46, 29, TeacherSession29
WILLIAM, Cxxxx, N/A, B GLEZEN, 183905, 11, 10, TeacherSession10, 9, TeacherSession9, 21, TeacherSession21, 24, TeacherSession24
AVERY, Mxxx, N/A, G BRAMLETT, 196437, 11, 19, TeacherSession19, 29, TeacherSession29, 17, TeacherSession17, 37, TeacherSession37
JEREMIAH, Mxxxxx, N/A, ORTON, 159578, 11, 21, TeacherSession21, 22, TeacherSession22, 24, TeacherSession24, 19, TeacherSession19
CORA, Pxxxxxx, N/A, G BRAMLETT, 114715, 11, 41, TeacherSession41, 39, TeacherSession39, 10, TeacherSession10, 9, TeacherSession9
AMANDA, Mxxxxx, N/A, PITTENGER, 132147, 11, 8, TeacherSession8, 10, TeacherSession10, 39, TeacherSession39, 22, TeacherSession22
TADI, Zxxxxxx, N/A, PITTENGER, 134381, 11, 41, TeacherSession41, 19, TeacherSession19, 37, TeacherSession37, 44, TeacherSession44
NIKHIL, Pxxxx, N/A, JERDON, 117056, 11, 11, TeacherSession11, 13, TeacherSession13, 12, TeacherSession12, 41, TeacherSession41
ABIGAIL, Fxxxx, N/A, B GLEZEN, 161955, 11, 42, TeacherSession42, 19, TeacherSession19, 41, TeacherSession41, 2, TeacherSession2
KING JULIAN, Lxxxx xx xxxxxxxx, N/A, B GLEZEN, 117413, 11, 3, TeacherSession3, 2, TeacherSession2, 42, TeacherSession42, 36, TeacherSession36
LOLA, Lxxx xx xxxxxxx xx xxxxxxx, N/A, B GLEZEN, 130408, 11, 42, TeacherSession42, 2, TeacherSession2, 44, TeacherSession44, 28, TeacherSession28
ERIC, Zxxxx, N/A, PITTENGER, 156228, 11, 13, TeacherSession13, 12, TeacherSession12, 45, TeacherSession45, 4, TeacherSession4
LILY, Rxxxxxxxx, N/A, JERDON, 125050, 11, 31, TeacherSession31, 34, TeacherSession34, 33, TeacherSession33, 2, TeacherSession2
ALEXANDER, Vxxxxxxxx, N/A, JERDON, 112726, 11, 15, TeacherSession15, 14, TeacherSession14, 23, TeacherSession23, 28, TeacherSession28
PARKER, Wxxxx, N/A, PITTENGER, 192243, 11, 12, TeacherSession12, 13, TeacherSession13, 7, TeacherSession7, 11, TeacherSession11
ZACHARY, Wxxxx, N/A, PITTENGER, 118986, 11, 12, TeacherSession12, 13, TeacherSession13, 8, TeacherSession8, 7, TeacherSession7
SHUHUAI, Xx, N/A, PITTENGER, 180373, 11, 14, TeacherSession14, 16, TeacherSession16, 39, TeacherSession39, 43, TeacherSession43
AARON, Sxxx, N/A, JERDON, 156456, 11, 12, TeacherSession12, 31, TeacherSession31, 19, TeacherSession19, 10, TeacherSession10
JACKSON, Bxxxx, N/A, PITTENGER, 120425, 11, 45, TeacherSession45, 40, TeacherSession40, 38, TeacherSession38, 21, TeacherSession21
CLAIRE, Cxxx, N/A, SNIVELY, 109500, 11, 37, TeacherSession37, 46, TeacherSession46, 32, TeacherSession32, 41, TeacherSession41
JACKSON, Txxxxxx, N/A, JERDON, 149154, 11, 34, TeacherSession34, 10, TeacherSession10, 5, TeacherSession5, 12, TeacherSession12
TRISTAN, Mxxxxxxxxx, N/A, ORTON, 179383, 11, 21, TeacherSession21, 19, TeacherSession19, 24, TeacherSession24, 23, TeacherSession23
DIEGO, Pxxxxx, N/A, JERDON, 157780, 11, 34, TeacherSession34, 33, TeacherSession33, 5, TeacherSession5, 12, TeacherSession12
LINDSEY, Hxxxxxxx, N/A, A GLEZEN, 122861, 11, 29, TeacherSession29, 32, TeacherSession32, 28, TeacherSession28, 30, TeacherSession30
WILLIAM, Jxxxxxx, N/A, B GLEZEN, 198071, 11, 3, TeacherSession3, 29, TeacherSession29, 23, TeacherSession23, 21, TeacherSession21
TAYLOR, Mxxxxxxx, N/A, ORTON, 131288, 11, 2, TeacherSession2, 19, TeacherSession19, 16, TeacherSession16, 17, TeacherSession17
ANGELINA, Txxxxxx, N/A, JERDON, 149660, 11, 42, TeacherSession42, 34, TeacherSession34, 19, TeacherSession19, 2, TeacherSession2
MAX, Rxxxxx, N/A, JERDON, 149022, 11, 42, TeacherSession42, 34, TeacherSession34, 19, TeacherSession19, 2, TeacherSession2
TALA, Rxxxx, N/A, JERDON, 187089, 11, 22, TeacherSession22, 43, TeacherSession43, 19, TeacherSession19, 23, TeacherSession23
ALICE, Lxx, N/A, B GLEZEN, 177875, 11, 46, TeacherSession46, 37, TeacherSession37, 35, TeacherSession35, 34, TeacherSession34
REESE, Cxxxxxxx, N/A, SNIVELY, 175328, 11, 35, TeacherSession35, 43, TeacherSession43, 19, TeacherSession19, 22, TeacherSession22
GRACE, Mxxxxx, N/A, ORTON, 148965, 11, 28, TeacherSession28, 19, TeacherSession19, 22, TeacherSession22, 17, TeacherSession17
WILLIAM, Sxxxxxx, N/A, JERDON, 151310, 11, 10, TeacherSession10, 9, TeacherSession9, 8, TeacherSession8, 40, TeacherSession40
ZIVA, Lxxxx, N/A, ORTON, 113176, 11, 19, TeacherSession19, 4, TeacherSession4, 22, TeacherSession22, 38, TeacherSession38
SOPHIA, Fxxxxx, N/A, B GLEZEN, 176325, 11, 37, TeacherSession37, 46, TeacherSession46, 29, TeacherSession29, 17, TeacherSession17
SAMANTHA, Sxxxxxxxx, N/A, PITTENGER, 165844, 11, 35, TeacherSession35, 46, TeacherSession46, 45, TeacherSession45, 19, TeacherSession19
BROOKE, Hxxxxxxx, N/A, JERDON, 114121, 11, 19, TeacherSession19, 23, TeacherSession23, 43, TeacherSession43, 28, TeacherSession28
JOSH, Mxxx, N/A, ORTON, 123902, 11, 40, TeacherSession40, 38, TeacherSession38, 16, TeacherSession16, 34, TeacherSession34
RAEVIN, Mxxxxxx, N/A, ORTON, 108551, 11, 5, TeacherSession5, 6, TeacherSession6, 19, TeacherSession19, 46, TeacherSession46
DANIELLE, Sxxxxxxxxx, N/A, ORTON, 153237, 11, 37, TeacherSession37, 43, TeacherSession43, 23, TeacherSession23, 28, TeacherSession28
CAELAN, Mxxxxxxxxx, N/A, ORTON, 110752, 11, 4, TeacherSession4, 1, TeacherSession1, 2, TeacherSession2, 42, TeacherSession42
CLARA, Kxxx, N/A, B GLEZEN, 137869, 11, 30, TeacherSession30, 28, TeacherSession28, 35, TeacherSession35, 37, TeacherSession37
GABRIEL, Jxxxxxx, N/A, PITTENGER, 151059, 11, 11, TeacherSession11, 6, TeacherSession6, 15, TeacherSession15, 12, TeacherSession12
ETHAN, Mxxxxx, N/A, ORTON, 165895, 11, 1, TeacherSession1, 2, TeacherSession2, 18, TeacherSession18, 19, TeacherSession19
AMELIA, Gxxxxxxxx, N/A, PITTENGER, 155857, 11, 1, TeacherSession1, 2, TeacherSession2, 14, TeacherSession14, 15, TeacherSession15
LEAH, Nxxxxx, N/A, ORTON, 120828, 11, 18, TeacherSession18, 43, TeacherSession43, 44, TeacherSession44, 35, TeacherSession35
LUKE, Mxxxxx, N/A, ORTON, 191836, 11, 39, TeacherSession39, 1, TeacherSession1, 23, TeacherSession23, 21, TeacherSession21
ANNIE, Nxxxxx, N/A, ORTON, 161257, 11, 35, TeacherSession35, 29, TeacherSession29, 15, TeacherSession15, 19, TeacherSession19
EMILY, Mxxxxxxx, N/A, A GLEZEN, 196867, 11, 41, TeacherSession41, 37, TeacherSession37, 32, TeacherSession32, 25, TeacherSession25
JAELYNN, Lxxxxxxx, N/A, A GLEZEN, 168685, 11, 19, TeacherSession19, 22, TeacherSession22, 29, TeacherSession29, 44, TeacherSession44
HLLA, Wxxxxx, N/A, PITTENGER, 168426, 11, 28, TeacherSession28, 13, TeacherSession13, 43, TeacherSession43, 45, TeacherSession45
AVA, Hxxxxxxx, N/A, A GLEZEN, 184681, 11, 19, TeacherSession19, 35, TeacherSession35, 46, TeacherSession46, 28, TeacherSession28
GABBY, Mxxxxx, N/A, A GLEZEN, 167991, 11, 19, TeacherSession19, 28, TeacherSession28, 33, TeacherSession33, 34, TeacherSession34
HANNAH, Jxxxx, N/A, A GLEZEN, 196067, 11, 18, TeacherSession18, 19, TeacherSession19, 4, TeacherSession4, 15, TeacherSession15
HANNAH, Lxxxxxxx, N/A, ORTON, 123289, 11, 30, TeacherSession30, 19, TeacherSession19, 28, TeacherSession28, 35, TeacherSession35
SELA, Hxxxxx, N/A, A GLEZEN, 168257, 11, 37, TeacherSession37, 33, TeacherSession33, 46, TeacherSession46, 2, TeacherSession2
TYLER, Lxxx, N/A, A GLEZEN, 162896, 11, 19, TeacherSession19, 44, TeacherSession44, 11, TeacherSession11, 27, TeacherSession27
ZAINAB, Hxxxxxx, N/A, A GLEZEN, 111410, 11, 10, TeacherSession10, 8, TeacherSession8, 6, TeacherSession6, 4, TeacherSession4
KEIRA, Lxx, N/A, A GLEZEN, 130339, 11, 28, TeacherSession28, 43, TeacherSession43, 35, TeacherSession35, 37, TeacherSession37
BLAKE, Jxxxxxx, N/A, A GLEZEN, 199335, 11, 18, TeacherSession18, 16, TeacherSession16, 5, TeacherSession5, 7, TeacherSession7
PEYTON, Hxxxx, N/A, A GLEZEN, 146919, 11, 28, TeacherSession28, 35, TeacherSession35, 37, TeacherSession37, 46, TeacherSession46
PENELOPE, Mxxxxxx, N/A, B GLEZEN, 185292, 11, 37, TeacherSession37, 28, TeacherSession28, 46, TeacherSession46, 45, TeacherSession45
KELLYN, Hxxxxxxx, N/A, A GLEZEN, 128461, 11, 1, TeacherSession1, 10, TeacherSession10, 41, TeacherSession41, 9, TeacherSession9
LAELIA, Pxxxxxx, N/A, ROBBINS, 140678, 10, 12, TeacherSession12, 2, TeacherSession2, 19, TeacherSession19, 44, TeacherSession44
MAGGIE, Qxx, N/A, N BRAMLETT, 132817, 10, 18, TeacherSession18, 27, TeacherSession27, 26, TeacherSession26, 16, TeacherSession16
SRUTHI, Sxxxxx, N/A, ROBBINS, 129846, 10, 4, TeacherSession4, 14, TeacherSession14, 37, TeacherSession37, 35, TeacherSession35
BRAYDEN, Gxxxxx, N/A, N BRAMLETT, 114783, 10, 43, TeacherSession43, 6, TeacherSession6, 12, TeacherSession12, 4, TeacherSession4
RAAHA, Sxxxxxxxxx, N/A, ROBBINS, 172446, 10, 37, TeacherSession37, 28, TeacherSession28, 41, TeacherSession41, 32, TeacherSession32
MILI, Pxxxx, N/A, ROBBINS, 100946, 10, 13, TeacherSession13, 37, TeacherSession37, 7, TeacherSession7, 32, TeacherSession32
RAY, Hxxxx, N/A, N BRAMLETT, 190390, 10, 5, TeacherSession5, 8, TeacherSession8, 9, TeacherSession9, 10, TeacherSession10
TREVEN, Lxxxx, N/A, KHLYABICH, 153042, 10, 12, TeacherSession12, 13, TeacherSession13, 19, TeacherSession19, 11, TeacherSession11
LILLY, Pxxxx, N/A, ROBBINS, 178770, 10, 35, TeacherSession35, 22, TeacherSession22, 17, TeacherSession17, 19, TeacherSession19
MIA, Pxxxx, N/A, ROBBINS, 113887, 10, 15, TeacherSession15, 4, TeacherSession4, 43, TeacherSession43, 14, TeacherSession14
WILLIAM, Exxxxxx, N/A, N BRAMLETT, 187965, 10, 36, TeacherSession36, 34, TeacherSession34, 44, TeacherSession44, 42, TeacherSession42
AKSHAY, Vxxxxx, N/A, N BRAMLETT, 100063, 10, 1, TeacherSession1, 2, TeacherSession2, 3, TeacherSession3, 4, TeacherSession4
NATHAN, Dx xxxx, N/A, N BRAMLETT, 137947, 10, 12, TeacherSession12, 7, TeacherSession7, 5, TeacherSession5, 13, TeacherSession13
SIENNA, Lxxx, N/A, KELLY, 119928, 10, 43, TeacherSession43, 41, TeacherSession41, 4, TeacherSession4, 6, TeacherSession6
KAYNAM, Nxxxxxxxxxxxxxxxxxxx, N/A, ROBBINS, 123264, 10, 46, TeacherSession46, 29, TeacherSession29, 37, TeacherSession37, 17, TeacherSession17
SOPHIA, Gxxxxxxxxx, N/A, N BRAMLETT, 105957, 10, 29, TeacherSession29, 19, TeacherSession19, 22, TeacherSession22, 20, TeacherSession20
EMILY, Lxxxxx, N/A, ROSS, 186954, 10, 2, TeacherSession2, 43, TeacherSession43, 28, TeacherSession28, 44, TeacherSession44
JERRY, Lxx, N/A, KELLY, 172606, 10, 2, TeacherSession2, 1, TeacherSession1, 29, TeacherSession29, 6, TeacherSession6
TAMIM, Sxxxxx, N/A, ROSS, 199452, 10, 1, TeacherSession1, 2, TeacherSession2, 5, TeacherSession5, 7, TeacherSession7
BELEN, Cxxxxxxx, N/A, ROSS, 121557, 10, 2, TeacherSession2, 43, TeacherSession43, 28, TeacherSession28, 17, TeacherSession17
MATTHEW, Gxxxxxxx, N/A, N BRAMLETT, 179482, 10, 37, TeacherSession37, 46, TeacherSession46, 44, TeacherSession44, 45, TeacherSession45
AMY, Cxxxxxx, N/A, ROSS, 133899, 10, 19, TeacherSession19, 45, TeacherSession45, 4, TeacherSession4, 1, TeacherSession1
ALEXANDER NEFF, Nxxx, N/A, ROSS, 110991, 10, 45, TeacherSession45, 36, TeacherSession36, 22, TeacherSession22, 19, TeacherSession19
RACHEL, Cxxx, N/A, REGAN, 121820, 10, 16, TeacherSession16, 19, TeacherSession19, 17, TeacherSession17, 39, TeacherSession39
MIKE, Dxxxxxx, N/A, REGAN, 105522, 10, 43, TeacherSession43, 6, TeacherSession6, 42, TeacherSession42, 36, TeacherSession36
DANIELLA, Fxxxxxx, N/A, REGAN, 175206, 10, 8, TeacherSession8, 9, TeacherSession9, 16, TeacherSession16, 26, TeacherSession26
YOUSSEF, Hxxxxxx, N/A, N BRAMLETT, 109065, 10, 13, TeacherSession13, 18, TeacherSession18, 23, TeacherSession23, 22, TeacherSession22
