DANIELA, Jxxxxxx, N/A, CAPRON, 168951, 9, 28, TeacherSession28, 35, TeacherSession35, 15, TeacherSession15, 17, TeacherSession17
JOEY, Jxxxx, N/A, CAPRON, 154154, 9, 43, TeacherSession43, 12, TeacherSession12, 11, TeacherSession11, 37, TeacherSession37
SOPHIA, Kxxx, N/A, CAPRON, 119680, 9, 37, TeacherSession37, 32, TeacherSession32, 15, TeacherSession15, 28, TeacherSession28
ISABELLE, Gxxxxx, N/A, BARRETT, 173654, 9, 1, TeacherSession1, 33, TeacherSession33, 4, TeacherSession4, 8, TeacherSession8
GRAYSON, Mxxxx, N/A, CAPRON, 148055, 9, 18, TeacherSession18, 20, TeacherSession20, 21, TeacherSession21, 22, TeacherSession22
TIFFANY, Dxxxx, N/A, FOSTER, 110910, 9, 15, TeacherSession15, 13, TeacherSession13, 3, TeacherSession3, 5, TeacherSession5
DAVID, Lxxxxxxx, N/A, SCOTT-RODGERS, 135591, 9, 26, TeacherSession26, 17, TeacherSession17, 23, TeacherSession23, 15, TeacherSession15
SHIVAM, Gxxx, N/A, BARRETT, 135945, 9, 10, TeacherSession10, 9, TeacherSession9, 1, TeacherSession1, 7, TeacherSession7
PRESTON, Cxxxxxx, N/A, MARTIN, 149091, 9, 34, TeacherSession34, 1, TeacherSession1, 7, TeacherSession7, 8, TeacherSession8
OLIVIA, Bxxxxxxx, N/A, DOWNIE, 166737, 9, 35, TeacherSession35, 37, TeacherSession37, 22, TeacherSession22, 17, TeacherSession17
BRIANNA, Sxxxxxxxxx, N/A, DOWNIE, 173772, 9, 46, TeacherSession46, 28, TeacherSession28, 4, TeacherSession4, 44, TeacherSession44
CYDNEE, Mxxxxxx, N/A, SCOTT-RODGERS, 150629, 9, 9, TeacherSession9, 8, TeacherSession8, 10, TeacherSession10, 11, TeacherSession11
HARMONEY, Sxxx, N/A, DOWNIE, 183913, 9, 34, TeacherSession34, 31, TeacherSession31, 17, TeacherSession17, 21, TeacherSession21
AMELIA, Sxxxxxx, N/A, DOWNIE, 131600, 9, 35, TeacherSession35, 37, TeacherSession37, 22, TeacherSession22, 17, TeacherSession17
GRACE, Lxxxx, N/A, CAPRON, 140308, 9, 2, TeacherSession2, 29, TeacherSession29, 34, TeacherSession34, 45, TeacherSession45
JORDYN, Mxxxx, N/A, CAPRON, 188561, 9, 2, TeacherSession2, 29, TeacherSession29, 34, TeacherSession34, 45, TeacherSession45
ZACH, Fxxxxx, N/A, FOSTER, 137796, 9, 28, TeacherSession28, 17, TeacherSession17, 16, TeacherSession16, 15, TeacherSession15
CARLEY, Sxxxxx, N/A, DOWNIE, 175194, 9, 36, TeacherSession36, 44, TeacherSession44, 26, TeacherSession26, 18, TeacherSession18
LILLY, Sxxxx, N/A, DOWNIE, 199240, 9, 2, TeacherSession2, 1, TeacherSession1, 45, TeacherSession45, 3, TeacherSession3
RILEY, Hxxxxxxxx, N/A, FOSTER, 171480, 9, 46, TeacherSession46, 23, TeacherSession23, 17, TeacherSession17, 41, TeacherSession41
JOHN, Mxxxxx, N/A, SCOTT-RODGERS, 107749, 9, 9, TeacherSession9, 6, TeacherSession6, 43, TeacherSession43, 8, TeacherSession8
COLETON, Exxxx, N/A, FOSTER, 124694, 9, 3, TeacherSession3, 16, TeacherSession16, 15, TeacherSession15, 10, TeacherSession10
CAL, Dxxx, N/A, BARRETT, 125402, 9, 13, TeacherSession13, 12, TeacherSession12, 5, TeacherSession5, 44, TeacherSession44
BENJAMIN, Hxxxx, N/A, GRIFFIN, 178334, 8, 5, TeacherSession5, 9, TeacherSession9, 17, TeacherSession17, 39, TeacherSession39
ANJALI, Sxxxxx, N/A, MACDONALD, 121782, 8, 22, TeacherSession22, 28, TeacherSession28, 35, TeacherSession35, 23, TeacherSession23
NICOLE, Mxxxxxxxx, N/A, MCCORMICK, 190666, 8, 18, TeacherSession18, 35, TeacherSession35, 4, TeacherSession4, 36, TeacherSession36
SAVANNAH, Mxxxxx, N/A, MCCORMICK, 101506, 8, 16, TeacherSession16, 15, TeacherSession15, 4, TeacherSession4, 14, TeacherSession14
ALLISON, Bxxx, N/A, GRAHAM, 176093, 8, 2, TeacherSession2, 1, TeacherSession1, 41, TeacherSession41, 11, TeacherSession11
BRAYDEN, Dxxxxxxx, N/A, GRIFFIN, 164634, 8, 43, TeacherSession43, 1, TeacherSession1, 31, TeacherSession31, 20, TeacherSession20
WILLIAM, Dxxxxxx, N/A, VAUTIER, 150876, 8, 11, TeacherSession11, 20, TeacherSession20, 43, TeacherSession43, 42, TeacherSession42
NATALIE, Pxxxx, N/A, ARCHIBALD, 106056, 8, 17, TeacherSession17, 2, TeacherSession2, 22, TeacherSession22, 1, TeacherSession1
JAKE, Pxxxxxxxx, N/A, ARCHIBALD, 120970, 8, 1, TeacherSession1, 43, TeacherSession43, 42, TeacherSession42, 2, TeacherSession2
CAITLIN, Cxxxx, N/A, GRAHAM, 172745, 8, 34, TeacherSession34, 31, TeacherSession31, 22, TeacherSession22, 28, TeacherSession28
AYDEN, wxxxxx, N/A, STEWART, 161865, 8, 8, TeacherSession8, 43, TeacherSession43, 10, TeacherSession10, 22, TeacherSession22
TAMID, Txxxxx, N/A, STEWART, 186713, 8, 8, TeacherSession8, 43, TeacherSession43, 10, TeacherSession10, 22, TeacherSession22
PATRICK, Txxxx, N/A, STEWART, 169082, 8, 8, TeacherSession8, 43, TeacherSession43, 10, TeacherSession10, 22, TeacherSession22
LILY, Wxxxx, N/A, STEWART, 157516, 8, 17, TeacherSession17, 41, TeacherSession41, 42, TeacherSession42, 15, TeacherSession15
JOHN, Txxxxx, N/A, MACDONALD, 112393, 8, 12, TeacherSession12, 10, TeacherSession10, 22, TeacherSession22, 38, TeacherSession38
AUDREY, Sxxxx, N/A, MACDONALD, 122676, 8, 23, TeacherSession23, 1, TeacherSession1, 17, TeacherSession17, 2, TeacherSession2
MARK, Txxxxx, N/A, MACDONALD, 192193, 8, 12, TeacherSession12, 22, TeacherSession22, 38, TeacherSession38, 40, TeacherSession40
DEVYN, Pxxxxxxx, N/A, ARCHIBALD, 163826, 8, 18, TeacherSession18, 15, TeacherSession15, 37, TeacherSession37, 16, TeacherSession16
ANIL, Mxxxxxxx, N/A, BARTLETT, 162555, 8, 17, TeacherSession17, 15, TeacherSession15, 5, TeacherSession5, 13, TeacherSession13
NATALIE, Mxxxxxxxx, N/A, MCCORMICK, 183367, 8, 1, TeacherSession1, 10, TeacherSession10, 40, TeacherSession40, 17, TeacherSession17
MATTHEW, Vxxxxxxx, N/A, STEWART, 160157, 8, 9, TeacherSession9, 10, TeacherSession10, 40, TeacherSession40, 22, TeacherSession22
ISABELLA, Sxxxxxxx, N/A, STEWART, 100848, 8, 16, TeacherSession16, 34, TeacherSession34, 1, TeacherSession1, 2, TeacherSession2
VINCENT, vxxxxxxxx, N/A, STEWART, 132288, 8, 8, TeacherSession8, 40, TeacherSession40, 38, TeacherSession38, 13, TeacherSession13
OTAVIO, Rxxxxxx, N/A, STEWART, 168095, 8, 9, TeacherSession9, 10, TeacherSession10, 40, TeacherSession40, 22, TeacherSession22
AINSLEY, cxxxxxxx, N/A, GRAHAM, 105658, 8, 21, TeacherSession21, 22, TeacherSession22, 20, TeacherSession20, 38, TeacherSession38
SKYLER, Lxxxxxxx, N/A, BARTLETT, 157832, 8, 12, TeacherSession12, 6, TeacherSession6, 14, TeacherSession14, 7, TeacherSession7
GRACE, Sxxxxx, N/A, STEWART, 170295, 8, 2, TeacherSession2, 17, TeacherSession17, 28, TeacherSession28, 32, TeacherSession32
CORWYN, Pxxxxxxxxx, N/A, ARCHIBALD, 159784, 8, 5, TeacherSession5, 4, TeacherSession4, 16, TeacherSession16, 38, TeacherSession38
BRITTANY, Sxxxxx, N/A, STEWART, 182830, 8, 37, TeacherSession37, 23, TeacherSession23, 38, TeacherSession38, 29, TeacherSession29
ISABELLE, Pxxxx, N/A, ARCHIBALD, 100767, 8, 42, TeacherSession42, 28, TeacherSession28, 15, TeacherSession15, 16, TeacherSession16
ALEXA, Gxxxxxxxx, N/A, GRIFFIN, 164200, 8, 42, TeacherSession42, 22, TeacherSession22, 43, TeacherSession43, 34, TeacherSession34
ALIANA, Yxxxx, N/A, STEWART, 146828, 8, 4, TeacherSession4, 6, TeacherSession6, 42, TeacherSession42, 1, TeacherSession1
GRETA, Rxxxxx, N/A, ARCHIBALD, 155912, 8, 22, TeacherSession22, 37, TeacherSession37, 43, TeacherSession43, 18, TeacherSession18
JULIAN, Txxx, N/A, MACDONALD, 133571, 8, 7, TeacherSession7, 2, TeacherSession2, 5, TeacherSession5, 17, TeacherSession17
ISABELLA, Qxxxxxxxx, N/A, ARCHIBALD, 197950, 8, 22, TeacherSession22, 37, TeacherSession37, 43, TeacherSession43, 18, TeacherSession18
NICOLE, Sxxxxx, N/A, ARCHIBALD, 167093, 8, 22, TeacherSession22, 37, TeacherSession37, 43, TeacherSession43, 18, TeacherSession18
ABHIRAM, Yxxxx, N/A, STEWART, 186084, 8, 9, TeacherSession9, 5, TeacherSession5, 8, TeacherSession8, 13, TeacherSession13
JULIUS, Sxxxxxx, N/A, MACDONALD, 153141, 8, 8, TeacherSession8, 10, TeacherSession10, 1, TeacherSession1, 16, TeacherSession16
DELILAH, Vxxxxxxxxx, N/A, STEWART, 153039, 8, 16, TeacherSession16, 37, TeacherSession37, 15, TeacherSession15, 17, TeacherSession17
RIYA, Rxxxx, N/A, MACDONALD, 196272, 8, 2, TeacherSession2, 17, TeacherSession17, 22, TeacherSession22, 43, TeacherSession43
GISELLE, Pxxxxxxxxxx, N/A, ARCHIBALD, 163435, 8, 42, TeacherSession42, 28, TeacherSession28, 30, TeacherSession30, 22, TeacherSession22
ANAY, Pxxxx, N/A, ARCHIBALD, 141725, 8, 17, TeacherSession17, 22, TeacherSession22, 37, TeacherSession37, 12, TeacherSession12
KAELANI, Lxxxxx, N/A, BARTLETT, 185796, 8, 28, TeacherSession28, 35, TeacherSession35, 2, TeacherSession2, 43, TeacherSession43
VICTORIA, Yx, N/A, MACDONALD, 151719, 8, 2, TeacherSession2, 4, TeacherSession4, 17, TeacherSession17, 43, TeacherSession43
AANYA, Sxxxx, N/A, MACDONALD, 137120, 8, 6, TeacherSession6, 13, TeacherSession13, 10, TeacherSession10, 12, TeacherSession12
AHANA, Gxxxxx, N/A, VAUTIER, 155255, 8, 43, TeacherSession43, 22, TeacherSession22, 37, TeacherSession37, 17, TeacherSession17
KRISI, Pxxxx, N/A, ARCHIBALD, 131724, 8, 11, TeacherSession11, 5, TeacherSession5, 1, TeacherSession1, 8, TeacherSession8
MANUEL, Gxxxxxxx, N/A, GRIFFIN, 170472, 8, 9, TeacherSession9, 12, TeacherSession12, 10, TeacherSession10, 5, TeacherSession5
JAIDA, lxxxx, N/A, MCCORMICK, 115475, 8, 35, TeacherSession35, 17, TeacherSession17, 23, TeacherSession23, 32, TeacherSession32
CHAMSSIA, mxxxxxxx, N/A, MCCORMICK, 150133, 8, 39, TeacherSession39, 26, TeacherSession26, 36, TeacherSession36, 5, TeacherSession5
RUBY, Nxxxx, N/A, ARCHIBALD, 137768, 8, 4, TeacherSession4, 12, TeacherSession12, 7, TeacherSession7, 5, TeacherSession5
VICTOR, Lxxxx, N/A, BARTLETT, 166872, 8, 42, TeacherSession42, 12, TeacherSession12, 16, TeacherSession16, 15, TeacherSession15
KEERTHI, Pxxxxxxxxx, N/A, STEWART, 147467, 8, 43, TeacherSession43, 13, TeacherSession13, 37, TeacherSession37, 11, TeacherSession11
RILEE, Nxxxxx, N/A, ARCHIBALD, 153232, 8, 23, TeacherSession23, 17, TeacherSession17, 43, TeacherSession43, 15, TeacherSession15
CAROLINA, Gxxxxxxxx, N/A, GRIFFIN, 160812, 8, 20, TeacherSession20, 22, TeacherSession22, 32, TeacherSession32, 1, TeacherSession1
MADISON, Sxxxx, N/A, STEWART, 126420, 8, 32, TeacherSession32, 15, TeacherSession15, 16, TeacherSession16, 3, TeacherSession3
ZOE, Jxxxxx, N/A, VAUTIER, 152417, 8, 9, TeacherSession9, 22, TeacherSession22, 10, TeacherSession10, 6, TeacherSession6
MICAH, Lxxxxxxx, N/A, MCCORMICK, 162703, 8, 12, TeacherSession12, 5, TeacherSession5, 1, TeacherSession1, 13, TeacherSession13
SEBASTIAN, nxxxx, N/A, MCCORMICK, 165890, 8, 12, TeacherSession12, 5, TeacherSession5, 1, TeacherSession1, 13, TeacherSession13
AKSHARA, Bxxxx, N/A, GRAHAM, 134104, 8, 16, TeacherSession16, 15, TeacherSession15, 17, TeacherSession17, 37, TeacherSession37
GREYSON, Sxxxx, N/A, MACDONALD, 160381, 8, 9, TeacherSession9, 8, TeacherSession8, 10, TeacherSession10, 18, TeacherSession18
DIYA, Yxxx, N/A, STEWART, 138807, 8, 42, TeacherSession42, 43, TeacherSession43, 2, TeacherSession2, 9, TeacherSession9
MATTHEW, Txxxxx, N/A, MACDONALD, 162649, 8, 13, TeacherSession13, 5, TeacherSession5, 12, TeacherSession12, 7, TeacherSession7
MAY, Yx, N/A, MACDONALD, 112565, 8, 4, TeacherSession4, 12, TeacherSession12, 2, TeacherSession2, 5, TeacherSession5
SLOANE, Kxxxxxx, N/A, BARTLETT, 129862, 8, 43, TeacherSession43, 2, TeacherSession2, 37, TeacherSession37, 34, TeacherSession34
JJ, Bxxxxxxxxx, N/A, REHM, 179578, 8, 24, TeacherSession24, 21, TeacherSession21, 18, TeacherSession18, 20, TeacherSession20
SPENCER, Cxxxxx, N/A, REHM, 159706, 8, 21, TeacherSession21, 9, TeacherSession9, 10, TeacherSession10, 1, TeacherSession1
ANDI, Gxxxxx, N/A, GRIFFIN, 167297, 8, 28, TeacherSession28, 35, TeacherSession35, 2, TeacherSession2, 43, TeacherSession43
LONDON, Wxxxxx, N/A, STEWART, 111996, 8, 2, TeacherSession2, 43, TeacherSession43, 42, TeacherSession42, 17, TeacherSession17
SHARON, Rxxxxxxx, N/A, ARCHIBALD, 161001, 8, 27, TeacherSession27, 18, TeacherSession18, 17, TeacherSession17, 10, TeacherSession10
OLIVIA, Sxxxx, N/A, STEWART, 163921, 8, 2, TeacherSession2, 43, TeacherSession43, 42, TeacherSession42, 17, TeacherSession17
AMBER, Bxxxxx, N/A, GRAHAM, 139926, 8, 40, TeacherSession40, 38, TeacherSession38, 10, TeacherSession10, 8, TeacherSession8
GWYNEVER, Cxxx, N/A, GRAHAM, 119927, 8, 17, TeacherSession17, 2, TeacherSession2, 1, TeacherSession1, 18, TeacherSession18
JONAH, Pxxxxx, N/A, MCCORMICK, 121074, 8, 12, TeacherSession12, 5, TeacherSession5, 1, TeacherSession1, 13, TeacherSession13
KEEGAN, Rxxxxxx, N/A, MACDONALD, 107305, 8, 2, TeacherSession2, 22, TeacherSession22, 5, TeacherSession5, 7, TeacherSession7
SAAHIL, Pxxxx, N/A, MCCORMICK, 100295, 8, 25, TeacherSession25, 13, TeacherSession13, 14, TeacherSession14, 6, TeacherSession6
SANKEERTH, Kxxxxxxxx, N/A, BARTLETT, 127329, 8, 26, TeacherSession26, 38, TeacherSession38, 21, TeacherSession21, 24, TeacherSession24
NATE, Mxxxxx, N/A, BARTLETT, 101041, 8, 20, TeacherSession20, 2, TeacherSession2, 1, TeacherSession1, 39, TeacherSession39
TYLER, Bxxxxxxxxx, N/A, GRAHAM, 169615, 8, 24, TeacherSession24, 9, TeacherSession9, 13, TeacherSession13, 41, TeacherSession41
MAGGIE, Mxxxxx, N/A, BARTLETT, 165720, 8, 25, TeacherSession25, 43, TeacherSession43, 4, TeacherSession4, 42, TeacherSession42
JAMES, Exxxxxx, N/A, GRIFFIN, 144496, 8, 26, TeacherSession26, 36, TeacherSession36, 1, TeacherSession1, 38, TeacherSession38
TRISTAN, Yxxxx, N/A, NAVARRETE, 142949, 8, 31, TeacherSession31, 11, TeacherSession11, 10, TeacherSession10, 1, TeacherSession1
CONNOR, Sxxxx, N/A, REHM, 130455, 8, 32, TeacherSession32, 4, TeacherSession4, 12, TeacherSession12, 11, TeacherSession11
HANA, Txxxxx, N/A, MACDONALD, 171364, 8, 7, TeacherSession7, 5, TeacherSession5, 3, TeacherSession3, 4, TeacherSession4
GWENDOLYN, Pxxx, N/A, MCCORMICK, 115526, 8, 20, TeacherSession20, 2, TeacherSession2, 35, TeacherSession35, 37, TeacherSession37
SETH, Bxxxxxxxx, N/A, REHM, 135804, 8, 24, TeacherSession24, 2, TeacherSession2, 32, TeacherSession32, 15, TeacherSession15
JAELYN, Jxxxx, N/A, GRIFFIN, 135640, 8, 25, TeacherSession25, 2, TeacherSession2, 37, TeacherSession37, 23, TeacherSession23
MANON, Exxxxxx, N/A, GRIFFIN, 194799, 8, 26, TeacherSession26, 2, TeacherSession2, 37, TeacherSession37, 16, TeacherSession16
ARYAN, Pxxxx, N/A, MACDONALD, 119586, 8, 27, TeacherSession27, 13, TeacherSession13, 11, TeacherSession11, 12, TeacherSession12
JOHN, hxxxxxx, N/A, GRIFFIN, 196592, 8, 31, TeacherSession31, 24, TeacherSession24, 42, TeacherSession42, 6, TeacherSession6
JOHN, Mxxxxxx, N/A, BARTLETT, 172373, 8, 32, TeacherSession32, 25, TeacherSession25, 5, TeacherSession5, 7, TeacherSession7
MICAH, fxxxxxxxx, N/A, GRIFFIN, 179609, 8, 7, TeacherSession7, 24, TeacherSession24, 43, TeacherSession43, 40, TeacherSession40
MATTHEW, Dxxxxxxxxx, N/A, REHM, 152912, 8, 20, TeacherSession20, 25, TeacherSession25, 32, TeacherSession32, 15, TeacherSession15
ELIANA, Bxxxxxxx, N/A, GRAHAM, 193072, 8, 24, TeacherSession24, 26, TeacherSession26, 4, TeacherSession4, 21, TeacherSession21
ANAYELI, Hxxxxxxxxxxxxx, N/A, GRIFFIN, 113982, 8, 25, TeacherSession25, 24, TeacherSession24, 35, TeacherSession35, 22, TeacherSession22
VICTORIA, axx, N/A, REHM, 160547, 8, 26, TeacherSession26, 25, TeacherSession25, 35, TeacherSession35, 23, TeacherSession23
RINAH, Pxxxxx, N/A, ARCHIBALD, 119641, 8, 27, TeacherSession27, 26, TeacherSession26, 17, TeacherSession17, 22, TeacherSession22
MICHAELA, Rxxxxxxx, N/A, MCCORMICK, 150514, 8, 31, TeacherSession31, 27, TeacherSession27, 29, TeacherSession29, 42, TeacherSession42
MASON, Hxxxxxx, N/A, BARTLETT, 135514, 8, 32, TeacherSession32, 39, TeacherSession39, 13, TeacherSession13, 16, TeacherSession16
CAMERON, Bxxxxxx, N/A, GRAHAM, 112152, 8, 36, TeacherSession36, 24, TeacherSession24, 1, TeacherSession1, 39, TeacherSession39
BRAYDEN, Pxxxxx, N/A, ARCHIBALD, 185968, 8, 3, TeacherSession3, 25, TeacherSession25, 8, TeacherSession8, 1, TeacherSession1
ELI, Gxxxxxx, N/A, VAUTIER, 137970, 8, 7, TeacherSession7, 26, TeacherSession26, 10, TeacherSession10, 8, TeacherSession8
ALIA, Exxxxxxxx, N/A, GRIFFIN, 102462, 8, 20, TeacherSession20, 27, TeacherSession27, 2, TeacherSession2, 13, TeacherSession13
JULIA, Dxxxxx, N/A, GRAHAM, 103836, 8, 23, TeacherSession23, 39, TeacherSession39, 42, TeacherSession42, 31, TeacherSession31
MEERA, Wxxxxx, N/A, STEWART, 186762, 8, 24, TeacherSession24, 40, TeacherSession40, 13, TeacherSession13, 36, TeacherSession36
COLBY, Dxxxxxxxx, N/A, GRAHAM, 123294, 8, 25, TeacherSession25, 14, TeacherSession14, 27, TeacherSession27, 12, TeacherSession12
CHANNING, axxxxxxxx, N/A, GRAHAM, 124257, 8, 26, TeacherSession26, 24, TeacherSession24, 39, TeacherSession39, 1, TeacherSession1
LILY, Cxxxxxxxx, N/A, GRAHAM, 179422, 8, 27, TeacherSession27, 25, TeacherSession25, 42, TeacherSession42, 31, TeacherSession31
JOY, Cxxx, N/A, GRAHAM, 129128, 8, 31, TeacherSession31, 26, TeacherSession26, 42, TeacherSession42, 35, TeacherSession35
KAITLYN, Axxxxxxx, N/A, GRAHAM, 178113, 8, 32, TeacherSession32, 27, TeacherSession27, 17, TeacherSession17, 15, TeacherSession15
MATTHEW, Bxxxx, N/A, REHM, 112747, 8, 36, TeacherSession36, 30, TeacherSession30, 41, TeacherSession41, 12, TeacherSession12
JERONIMO, Gxxxxx, N/A, GRIFFIN, 121366, 8, 39, TeacherSession39, 36, TeacherSession36, 7, TeacherSession7, 1, TeacherSession1
KAI, Hxxxxx, N/A, VAUTIER, 160294, 8, 40, TeacherSession40, 39, TeacherSession39, 9, TeacherSession9, 1, TeacherSession1
BROOKLYNN, Lxxxx, N/A, MCCORMICK, 187679, 8, 3, TeacherSession3, 40, TeacherSession40, 29, TeacherSession29, 42, TeacherSession42
ZOE, Wxxxxx, N/A, MCCORMICK, 142114, 8, 7, TeacherSession7, 3, TeacherSession3, 43, TeacherSession43, 2, TeacherSession2
NATAHLIA, Axxxx, N/A, REHM, 115402, 8, 11, TeacherSession11, 14, TeacherSession14, 2, TeacherSession2, 13, TeacherSession13
COLLEEN, Cxxxxxxx, N/A, GRAHAM, 182466, 8, 20, TeacherSession20, 18, TeacherSession18, 2, TeacherSession2, 1, TeacherSession1
IZABELLE, Dxxxx, N/A, REHM, 113039, 8, 23, TeacherSession23, 20, TeacherSession20, 2, TeacherSession2, 15, TeacherSession15
SHRITHIKA, Bxxxx, N/A, GRAHAM, 196570, 8, 24, TeacherSession24, 25, TeacherSession25, 37, TeacherSession37, 30, TeacherSession30
BRADY, Mxxxxx, N/A, BARTLETT, 139474, 8, 25, TeacherSession25, 24, TeacherSession24, 43, TeacherSession43, 15, TeacherSession15
SAM, Kxxxxx, N/A, BARTLETT, 141062, 8, 26, TeacherSession26, 27, TeacherSession27, 43, TeacherSession43, 15, TeacherSession15
SPENCER, Jxxxxx, N/A, GRIFFIN, 176773, 8, 27, TeacherSession27, 26, TeacherSession26, 4, TeacherSession4, 1, TeacherSession1
JAELYN, Ixxx, N/A, GRIFFIN, 199244, 8, 30, TeacherSession30, 31, TeacherSession31, 37, TeacherSession37, 1, TeacherSession1
SERGIO, Pxxxxx, N/A, ARCHIBALD, 161430, 8, 31, TeacherSession31, 30, TeacherSession30, 5, TeacherSession5, 1, TeacherSession1
JULIETTE, Bxxxx, N/A, REHM, 134545, 8, 32, TeacherSession32, 33, TeacherSession33, 37, TeacherSession37, 4, TeacherSession4
NOAH GRAY, Gxxx, N/A, GRIFFIN, 134397, 8, 33, TeacherSession33, 36, TeacherSession36, 5, TeacherSession5, 30, TeacherSession30
WILLIAM, Gxxxxxxx, N/A, VAUTIER, 114072, 8, 36, TeacherSession36, 39, TeacherSession39, 37, TeacherSession37, 12, TeacherSession12
MERA, Hxxxxx, N/A, GRIFFIN, 140540, 8, 39, TeacherSession39, 40, TeacherSession40, 5, TeacherSession5, 1, TeacherSession1
AMANDA, Bxxxxxx, N/A, REHM, 129689, 8, 40, TeacherSession40, 3, TeacherSession3, 37, TeacherSession37, 35, TeacherSession35
ALANA, Bxxxxxxxxxxxxx, N/A, REHM, 180981, 8, 3, TeacherSession3, 7, TeacherSession7, 10, TeacherSession10, 1, TeacherSession1
EVAN, Gxxxxxxxxx, N/A, GRIFFIN, 170120, 8, 6, TeacherSession6, 11, TeacherSession11, 5, TeacherSession5, 43, TeacherSession43
THOMAS, Cxxxxxxx, N/A, REHM, 182063, 8, 7, TeacherSession7, 14, TeacherSession14, 37, TeacherSession37, 10, TeacherSession10
KELLER, Mxxxx, N/A, BARTLETT, 122722, 8, 11, TeacherSession11, 18, TeacherSession18, 25, TeacherSession25, 5, TeacherSession5
BROOKE, Jxxxxxx, N/A, GRIFFIN, 193845, 8, 14, TeacherSession14, 20, TeacherSession20, 31, TeacherSession31, 4, TeacherSession4
TOMMY, Lxxxxxx, N/A, BARTLETT, 190883, 8, 20, TeacherSession20, 21, TeacherSession21, 25, TeacherSession25, 15, TeacherSession15
GWEN, Lxxx, N/A, MCCORMICK, 161584, 8, 21, TeacherSession21, 24, TeacherSession24, 31, TeacherSession31, 1, TeacherSession1
FAIZAN, Axxxx, N/A, GRAHAM, 113558, 8, 23, TeacherSession23, 25, TeacherSession25, 20, TeacherSession20, 1, TeacherSession1
BROOKLYN, Hxxx, N/A, VAUTIER, 138385, 8, 24, TeacherSession24, 26, TeacherSession26, 25, TeacherSession25, 1, TeacherSession1
JOSHUA, Oxxxx, N/A, MCCORMICK, 152763, 8, 25, TeacherSession25, 27, TeacherSession27, 24, TeacherSession24, 15, TeacherSession15
SEBASTIAN, Gxxxxxxx, N/A, VAUTIER, 180232, 8, 26, TeacherSession26, 30, TeacherSession30, 27, TeacherSession27, 25, TeacherSession25
HAIDEN, Fxxx, N/A, GRIFFIN, 132110, 8, 27, TeacherSession27, 31, TeacherSession31, 20, TeacherSession20, 33, TeacherSession33
ZOE, Lxxxxxxx, N/A, MCCORMICK, 104298, 8, 30, TeacherSession30, 33, TeacherSession33, 31, TeacherSession31, 20, TeacherSession20
ABIGAIL, Fxxxxxx, N/A, REHM, 123672, 8, 31, TeacherSession31, 36, TeacherSession36, 24, TeacherSession24, 25, TeacherSession25
JULIA, Bxxx, N/A, AUNE, 199053, 7, 32, TeacherSession32, 38, TeacherSession38, 25, TeacherSession25, 24, TeacherSession24
AYLA, Cxxxxxx, N/A, ESTEVEZ, 196688, 7, 33, TeacherSession33, 39, TeacherSession39, 26, TeacherSession26, 30, TeacherSession30
ELAINA, Nxxxx, N/A, SMITH, 170060, 7, 36, TeacherSession36, 40, TeacherSession40, 27, TeacherSession27, 33, TeacherSession33
JOHN, Pxxxxxx, N/A, SMITH, 159279, 7, 39, TeacherSession39, 3, TeacherSession3, 30, TeacherSession30, 20, TeacherSession20
KAYLEE, Cxxxxxx, N/A, ESTEVEZ, 147154, 7, 40, TeacherSession40, 7, TeacherSession7, 31, TeacherSession31, 3, TeacherSession3
BRYNLIE, Gxxxxxx, N/A, WALLING, 163348, 7, 3, TeacherSession3, 11, TeacherSession11, 33, TeacherSession33, 24, TeacherSession24
JORGE, Rxxx, N/A, KIMBERLY, 131249, 7, 6, TeacherSession6, 14, TeacherSession14, 18, TeacherSession18, 25, TeacherSession25
JUDAH, Lxxxxxxx, N/A, HACKER, 118367, 7, 7, TeacherSession7, 18, TeacherSession18, 20, TeacherSession20, 27, TeacherSession27
MASON, Rxxxx, N/A, SMITH, 157918, 7, 11, TeacherSession11, 20, TeacherSession20, 24, TeacherSession24, 29, TeacherSession29
MIA, Rxxxxx, N/A, SMITH, 171321, 7, 14, TeacherSession14, 21, TeacherSession21, 25, TeacherSession25, 30, TeacherSession30
CARSON, Rxxxxxxxxx, N/A, ATKINSON, 144108, 7, 20, TeacherSession20, 24, TeacherSession24, 26, TeacherSession26, 33, TeacherSession33
JAMES, Rxxxx, N/A, SMITH, 152727, 7, 21, TeacherSession21, 25, TeacherSession25, 27, TeacherSession27, 3, TeacherSession3
EASTON, Sxxxxxx, N/A, ATKINSON, 195436, 7, 23, TeacherSession23, 26, TeacherSession26, 30, TeacherSession30, 20, TeacherSession20
GRIFFIN, Mxxxxx, N/A, SMITH, 161284, 7, 24, TeacherSession24, 27, TeacherSession27, 31, TeacherSession31, 25, TeacherSession25
CARSTON, Cxxxx, N/A, JOHNSON, 100595, 7, 25, TeacherSession25, 30, TeacherSession30, 33, TeacherSession33, 24, TeacherSession24
JACK, Hxxxxxxx, N/A, WALLING, 146918, 7, 26, TeacherSession26, 31, TeacherSession31, 36, TeacherSession36, 27, TeacherSession27
SOPHIA, Gxxxxxxxx, N/A, AUNE, 149535, 7, 27, TeacherSession27, 32, TeacherSession32, 39, TeacherSession39, 26, TeacherSession26
GRACE, Gxxxxxx, N/A, AUNE, 153434, 7, 30, TeacherSession30, 33, TeacherSession33, 18, TeacherSession18, 29, TeacherSession29
MILEY, Yxxxxx, N/A, NAVARRETE, 178552, 7, 31, TeacherSession31, 36, TeacherSession36, 20, TeacherSession20, 30, TeacherSession30
KADEN, Mxxxxx, N/A, SMITH, 160302, 7, 32, TeacherSession32, 38, TeacherSession38, 24, TeacherSession24, 33, TeacherSession33
ISAAC, Pxxxxx, N/A, SMITH, 145990, 7, 33, TeacherSession33, 39, TeacherSession39, 25, TeacherSession25, 38, TeacherSession38
BRODY, fxxxxx, N/A, WALLING, 176797, 7, 36, TeacherSession36, 40, TeacherSession40, 26, TeacherSession26, 3, TeacherSession3
RYLEIGH, Bxxxxxxxx, N/A, AUNE, 195886, 7, 39, TeacherSession39, 41, TeacherSession41, 27, TeacherSession27, 40, TeacherSession40
BRAYDEN, Hxxx, N/A, WALLING, 173822, 7, 40, TeacherSession40, 3, TeacherSession3, 30, TeacherSession30, 6, TeacherSession6
REED, Sxxxxxx, N/A, ATKINSON, 177767, 7, 3, TeacherSession3, 7, TeacherSession7, 31, TeacherSession31, 20, TeacherSession20
CHAUNCEY, sxxxxxxxx, N/A, ATKINSON, 111861, 7, 6, TeacherSession6, 11, TeacherSession11, 33, TeacherSession33, 24, TeacherSession24
KEVIN, Rxxxxxxxx, N/A, SMITH, 189864, 7, 7, TeacherSession7, 14, TeacherSession14, 36, TeacherSession36, 25, TeacherSession25
AUSTIN, Pxxxxxx, N/A, KIMBERLY, 159438, 7, 11, TeacherSession11, 18, TeacherSession18, 39, TeacherSession39, 26, TeacherSession26
WALKER, Sxxxxxx, N/A, ATKINSON, 189985, 7, 14, TeacherSession14, 20, TeacherSession20, 6, TeacherSession6, 27, TeacherSession27
GABRIELLE, Dxxx, N/A, WALLING, 170922, 7, 17, TeacherSession17, 21, TeacherSession21, 9, TeacherSession9, 29, TeacherSession29
NATHAN, Pxxxxxxx, N/A, SMITH, 106119, 7, 20, TeacherSession20, 24, TeacherSession24, 12, TeacherSession12, 30, TeacherSession30
CHARLOTTE, Gxxxxx, N/A, WALLING, 131661, 7, 21, TeacherSession21, 25, TeacherSession25, 18, TeacherSession18, 31, TeacherSession31
BENJAMIN, Bxxxxx, N/A, ESTEVEZ, 147832, 7, 23, TeacherSession23, 26, TeacherSession26, 20, TeacherSession20, 33, TeacherSession33
SHAYNE, Sxxxxxx, N/A, ATKINSON, 198503, 7, 24, TeacherSession24, 27, TeacherSession27, 21, TeacherSession21, 38, TeacherSession38
ELI, Rxxx, N/A, ATKINSON, 189066, 7, 25, TeacherSession25, 30, TeacherSession30, 24, TeacherSession24, 39, TeacherSession39
KYLEE, Sxxxxx, N/A, ATKINSON, 180682, 7, 26, TeacherSession26, 31, TeacherSession31, 25, TeacherSession25, 40, TeacherSession40
JACKSON, Dxxxxx, N/A, AUNE, 129214, 7, 27, TeacherSession27, 32, TeacherSession32, 26, TeacherSession26, 3, TeacherSession3
JACKSON, Txxxx, N/A, NAVARRETE, 183591, 7, 29, TeacherSession29, 33, TeacherSession33, 27, TeacherSession27, 6, TeacherSession6
ELIZABETH, Lxxxxxxxxxxxxxx, N/A, HACKER, 168595, 7, 30, TeacherSession30, 34, TeacherSession34, 31, TeacherSession31, 20, TeacherSession20
