PRESTYN, Sxxxxx, N/A, ATKINSON, 175913, 7, 31, TeacherSession31, 36, TeacherSession36, 30, TeacherSession30, 24, TeacherSession24
NOAH, Mxxxxx, N/A, NAVARRETE, 110421, 7, 32, TeacherSession32, 38, TeacherSession38, 33, TeacherSession33, 25, TeacherSession25
LIAM, Sxxx, N/A, ATKINSON, 109277, 7, 33, TeacherSession33, 39, TeacherSession39, 36, TeacherSession36, 26, TeacherSession26
DANIEL, Dxxxxxxxx, N/A, WALLING, 157392, 7, 36, TeacherSession36, 40, TeacherSession40, 39, TeacherSession39, 27, TeacherSession27
ETHAN, Axxxx, N/A, ESTEVEZ, 199534, 7, 38, TeacherSession38, 41, TeacherSession41, 3, TeacherSession3, 29, TeacherSession29
AVA, Dxxxxxxx, N/A, WALLING, 124648, 7, 39, TeacherSession39, 3, TeacherSession3, 6, TeacherSession6, 30, TeacherSession30
RUOQI, Hxxxx, N/A, HACKER, 106350, 7, 40, TeacherSession40, 7, TeacherSession7, 9, TeacherSession9, 31, TeacherSession31
KENSINGTON, Sxxxxxxxxx, N/A, ATKINSON, 172080, 7, 3, TeacherSession3, 11, TeacherSession11, 12, TeacherSession12, 32, TeacherSession32
ARIA, Wxxxx, N/A, NAVARRETE, 127945, 7, 6, TeacherSession6, 14, TeacherSession14, 18, TeacherSession18, 33, TeacherSession33
JOHN, Txxxxxxx, N/A, OLSON, 128615, 7, 7, TeacherSession7, 18, TeacherSession18, 20, TeacherSession20, 38, TeacherSession38
ALLISON, Txxxx, N/A, OLSON, 133589, 7, 11, TeacherSession11, 20, TeacherSession20, 21, TeacherSession21, 39, TeacherSession39
COOPER, Exxxxxx, N/A, WALLING, 184477, 7, 14, TeacherSession14, 21, TeacherSession21, 24, TeacherSession24, 40, TeacherSession40
AVA, Lxxxxx xxxx, N/A, HACKER, 132872, 7, 17, TeacherSession17, 24, TeacherSession24, 25, TeacherSession25, 3, TeacherSession3
ASHTON, bxxx, N/A, AUNE, 183203, 7, 20, TeacherSession20, 25, TeacherSession25, 26, TeacherSession26, 6, TeacherSession6
BRANDON, Pxxx, N/A, JOHNSON, 161809, 7, 21, TeacherSession21, 26, TeacherSession26, 27, TeacherSession27, 20, TeacherSession20
IVANKA, Exxxxxxxxxxx, N/A, WALLING, 161248, 7, 22, TeacherSession22, 27, TeacherSession27, 30, TeacherSession30, 23, TeacherSession23
ADDISON, Dxxxx, N/A, AUNE, 144102, 7, 23, TeacherSession23, 30, TeacherSession30, 31, TeacherSession31, 24, TeacherSession24
COLTON, Fxxxxxx, N/A, WALLING, 190823, 7, 24, TeacherSession24, 31, TeacherSession31, 33, TeacherSession33, 25, TeacherSession25
GAGE, Mxxxxx, N/A, HACKER, 131012, 7, 25, TeacherSession25, 32, TeacherSession32, 36, TeacherSession36, 26, TeacherSession26
MERISSA, Sxxxxx, N/A, ATKINSON, 156949, 7, 26, TeacherSession26, 33, TeacherSession33, 39, TeacherSession39, 27, TeacherSession27
QIAO, Qxx, N/A, JOHNSON, 116221, 7, 27, TeacherSession27, 34, TeacherSession34, 40, TeacherSession40, 29, TeacherSession29
EVERETT, Fxxxxx, N/A, AUNE, 112493, 7, 29, TeacherSession29, 36, TeacherSession36, 3, TeacherSession3, 30, TeacherSession30
CALEB, Sxxxxxx, N/A, ATKINSON, 104558, 7, 30, TeacherSession30, 38, TeacherSession38, 6, TeacherSession6, 31, TeacherSession31
EMMA, sxxxxxx, N/A, ATKINSON, 114713, 7, 31, TeacherSession31, 39, TeacherSession39, 9, TeacherSession9, 32, TeacherSession32
SKYLA, Sxxxx, N/A, ATKINSON, 134077, 7, 32, TeacherSession32, 40, TeacherSession40, 12, TeacherSession12, 33, TeacherSession33
LILIANA, Rxxx, N/A, ATKINSON, 112524, 7, 33, TeacherSession33, 41, TeacherSession41, 14, TeacherSession14, 36, TeacherSession36
CILLIAN, Dxxxx, N/A, WALLING, 190549, 7, 36, TeacherSession36, 42, TeacherSession42, 18, TeacherSession18, 38, TeacherSession38
FELICITY, Mxxxx, N/A, HACKER, 169810, 7, 38, TeacherSession38, 3, TeacherSession3, 20, TeacherSession20, 39, TeacherSession39
PRATEIK, Axxxx, N/A, AUNE, 160002, 7, 39, TeacherSession39, 6, TeacherSession6, 21, TeacherSession21, 40, TeacherSession40
HADAR, Rxxxxxxxx, N/A, SMITH, 146831, 7, 40, TeacherSession40, 7, TeacherSession7, 24, TeacherSession24, 3, TeacherSession3
MARK, Sxxxxxxxxxx, N/A, ATKINSON, 156805, 7, 3, TeacherSession3, 11, TeacherSession11, 25, TeacherSession25, 6, TeacherSession6
JACOB, Sxx, N/A, OLSON, 194072, 7, 6, TeacherSession6, 14, TeacherSession14, 26, TeacherSession26, 16, TeacherSession16
SOUHEIL, Sxxxxxx, N/A, ATKINSON, 176726, 7, 7, TeacherSession7, 16, TeacherSession16, 27, TeacherSession27, 14, TeacherSession14
WILLOW, Wxxxxxx, N/A, OLSON, 153068, 7, 11, TeacherSession11, 18, TeacherSession18, 30, TeacherSession30, 20, TeacherSession20
JORDAN, Jxxxx, N/A, HACKER, 198766, 7, 14, TeacherSession14, 20, TeacherSession20, 31, TeacherSession31, 23, TeacherSession23
MIA, Oxxxxxxxx, N/A, SMITH, 104503, 7, 16, TeacherSession16, 21, TeacherSession21, 33, TeacherSession33, 24, TeacherSession24
DYLAN, Vxxxx, N/A, NAVARRETE, 156058, 7, 17, TeacherSession17, 24, TeacherSession24, 36, TeacherSession36, 25, TeacherSession25
ZAYD, Zxxxxx, N/A, OLSON, 160269, 7, 20, TeacherSession20, 25, TeacherSession25, 39, TeacherSession39, 26, TeacherSession26
TRIPP, Txxxxxxxx, N/A, OLSON, 104355, 7, 21, TeacherSession21, 26, TeacherSession26, 40, TeacherSession40, 27, TeacherSession27
KUSH, Vxxxxxxx, N/A, OLSON, 152918, 7, 22, TeacherSession22, 27, TeacherSession27, 3, TeacherSession3, 29, TeacherSession29
CAROLINE, Cxxxxxx, N/A, ESTEVEZ, 174745, 7, 23, TeacherSession23, 30, TeacherSession30, 6, TeacherSession6, 31, TeacherSession31
HARPER, Rxxxxxxxxx, N/A, JOHNSON, 136829, 7, 24, TeacherSession24, 31, TeacherSession31, 9, TeacherSession9, 30, TeacherSession30
PEDRO, Hxxxxxxxx, N/A, WALLING, 104996, 7, 25, TeacherSession25, 32, TeacherSession32, 12, TeacherSession12, 33, TeacherSession33
JOSHUA, Cxxxxxx, N/A, ESTEVEZ, 171050, 7, 26, TeacherSession26, 33, TeacherSession33, 14, TeacherSession14, 32, TeacherSession32
LOGAN, Gxxxxx, N/A, WALLING, 105426, 7, 27, TeacherSession27, 34, TeacherSession34, 18, TeacherSession18, 36, TeacherSession36
SOFIA, fxxxxxx, N/A, WALLING, 124443, 7, 29, TeacherSession29, 36, TeacherSession36, 20, TeacherSession20, 38, TeacherSession38
NATAN, Vxx, N/A, OLSON, 112365, 7, 30, TeacherSession30, 38, TeacherSession38, 21, TeacherSession21, 39, TeacherSession39
AARON, Wxxxx, N/A, OLSON, 175624, 7, 31, TeacherSession31, 39, TeacherSession39, 24, TeacherSession24, 40, TeacherSession40
BROOKLYN, Kxxxxx, N/A, HACKER, 144922, 7, 32, TeacherSession32, 40, TeacherSession40, 25, TeacherSession25, 41, TeacherSession41
JEBRAAN, Jxxxxxx, N/A, HACKER, 102062, 7, 33, TeacherSession33, 41, TeacherSession41, 26, TeacherSession26, 3, TeacherSession3
IAN, Wxxxxxxx, N/A, NAVARRETE, 110345, 7, 36, TeacherSession36, 42, TeacherSession42, 27, TeacherSession27, 6, TeacherSession6
LYLA, Sxxxxx, N/A, OLSON, 171490, 7, 38, TeacherSession38, 3, TeacherSession3, 30, TeacherSession30, 14, TeacherSession14
GENEVIEVE, Nxxxx, N/A, JOHNSON, 175089, 7, 39, TeacherSession39, 4, TeacherSession4, 31, TeacherSession31, 16, TeacherSession16
KORELAI, Oxxxx, N/A, JOHNSON, 113727, 7, 40, TeacherSession40, 6, TeacherSession6, 33, TeacherSession33, 20, TeacherSession20
MONA, Gxxxxx, N/A, WALLING, 162826, 7, 3, TeacherSession3, 7, TeacherSession7, 36, TeacherSession36, 21, TeacherSession21
TESSA, Rxxxxxx, N/A, JOHNSON, 168284, 7, 5, TeacherSession5, 11, TeacherSession11, 39, TeacherSession39, 23, TeacherSession23
JOY, Lxx, N/A, HACKER, 182201, 7, 6, TeacherSession6, 14, TeacherSession14, 40, TeacherSession40, 24, TeacherSession24
DYLAN, Lxxxx, N/A, HACKER, 165272, 7, 7, TeacherSession7, 16, TeacherSession16, 3, TeacherSession3, 25, TeacherSession25
ALDO, Nxxxx, N/A, SMITH, 121639, 7, 11, TeacherSession11, 18, TeacherSession18, 6, TeacherSession6, 26, TeacherSession26
RYAN, Wxxxx, N/A, OLSON, 130921, 7, 14, TeacherSession14, 20, TeacherSession20, 9, TeacherSession9, 27, TeacherSession27
VICTORIA, Gxxxxx, N/A, WALLING, 179307, 7, 16, TeacherSession16, 21, TeacherSession21, 12, TeacherSession12, 29, TeacherSession29
LUIS, Mxxxxx, N/A, JOHNSON, 159395, 7, 17, TeacherSession17, 23, TeacherSession23, 14, TeacherSession14, 30, TeacherSession30
ANGELINA, Lx, N/A, HACKER, 100894, 7, 20, TeacherSession20, 24, TeacherSession24, 18, TeacherSession18, 31, TeacherSession31
VICTORIA, Sxxxx, N/A, OLSON, 125744, 7, 21, TeacherSession21, 25, TeacherSession25, 20, TeacherSession20, 32, TeacherSession32
LORENA, Jxxxx xxxxxxx, N/A, HACKER, 120271, 7, 22, TeacherSession22, 26, TeacherSession26, 21, TeacherSession21, 33, TeacherSession33
ABIGAIL, Wxxx, N/A, NAVARRETE, 135595, 7, 23, TeacherSession23, 27, TeacherSession27, 24, TeacherSession24, 35, TeacherSession35
MAX, Mxxxx, N/A, HACKER, 161338, 7, 24, TeacherSession24, 30, TeacherSession30, 25, TeacherSession25, 36, TeacherSession36
SAMANTHA, Jxxxx, N/A, HACKER, 111391, 7, 25, TeacherSession25, 31, TeacherSession31, 26, TeacherSession26, 38, TeacherSession38
MIA, Pxxxxxx, N/A, SMITH, 196805, 7, 26, TeacherSession26, 32, TeacherSession32, 27, TeacherSession27, 39, TeacherSession39
HENRIQUE, sxxxxx, N/A, ATKINSON, 183773, 7, 27, TeacherSession27, 33, TeacherSession33, 30, TeacherSession30, 40, TeacherSession40
TOMMY, Wxxxxxx, N/A, OLSON, 119683, 7, 29, TeacherSession29, 34, TeacherSession34, 31, TeacherSession31, 41, TeacherSession41
NAOMI, Wxxxxxx, N/A, NAVARRETE, 141010, 7, 30, TeacherSession30, 35, TeacherSession35, 33, TeacherSession33, 3, TeacherSession3
LIAM, Txxxxx, N/A, NAVARRETE, 142016, 7, 31, TeacherSession31, 36, TeacherSession36, 39, TeacherSession39, 6, TeacherSession6
SIONE, Txxx, N/A, NAVARRETE, 180095, 7, 32, TeacherSession32, 38, TeacherSession38, 36, TeacherSession36, 9, TeacherSession9
VISHRUTH, Mxxxxx, N/A, JOHNSON, 159825, 7, 33, TeacherSession33, 39, TeacherSession39, 40, TeacherSession40, 14, TeacherSession14
MIA, Txxxxxxx, N/A, NAVARRETE, 199062, 7, 36, TeacherSession36, 40, TeacherSession40, 3, TeacherSession3, 16, TeacherSession16
HARPER, Wxxxxxxxxx, N/A, NAVARRETE, 182262, 7, 38, TeacherSession38, 41, TeacherSession41, 6, TeacherSession6, 20, TeacherSession20
ANDREW, Txxxxx, N/A, NAVARRETE, 147931, 7, 39, TeacherSession39, 42, TeacherSession42, 7, TeacherSession7, 21, TeacherSession21
VICTORIA, Hxxxxxxxxx, N/A, WALLING, 117120, 7, 40, TeacherSession40, 3, TeacherSession3, 9, TeacherSession9, 23, TeacherSession23
MASSIMO, Rxxxxx, N/A, ATKINSON, 138502, 7, 3, TeacherSession3, 4, TeacherSession4, 12, TeacherSession12, 24, TeacherSession24
MILES, Sxxxxx, N/A, ATKINSON, 172987, 7, 5, TeacherSession5, 6, TeacherSession6, 14, TeacherSession14, 25, TeacherSession25
ALEX, txxxxxx, N/A, ATKINSON, 109548, 7, 6, TeacherSession6, 7, TeacherSession7, 18, TeacherSession18, 26, TeacherSession26
LEAH, Wxxxxx, N/A, NAVARRETE, 189734, 7, 7, TeacherSession7, 11, TeacherSession11, 20, TeacherSession20, 27, TeacherSession27
ELENA, Exxxx, N/A, WALLING, 146449, 7, 8, TeacherSession8, 14, TeacherSession14, 21, TeacherSession21, 29, TeacherSession29
CARLEY, Txxxxx, N/A, NAVARRETE, 158431, 7, 11, TeacherSession11, 16, TeacherSession16, 24, TeacherSession24, 30, TeacherSession30
HANNAH, Txx xxxx, N/A, NAVARRETE, 109580, 7, 14, TeacherSession14, 17, TeacherSession17, 25, TeacherSession25, 31, TeacherSession31
JUNE, vxx xxxxxx, N/A, NAVARRETE, 187142, 7, 16, TeacherSession16, 18, TeacherSession18, 26, TeacherSession26, 32, TeacherSession32
ALEJSNDRO, Pxxxxxx, N/A, JOHNSON, 179349, 7, 17, TeacherSession17, 20, TeacherSession20, 27, TeacherSession27, 33, TeacherSession33
AUDREY, Mxxxxx, N/A, HACKER, 150377, 7, 20, TeacherSession20, 21, TeacherSession21, 29, TeacherSession29, 35, TeacherSession35
