GRACE, Sxxxxxxxxx, N/A, RADD, 132216, 10, 34, TeacherSession34, 19, TeacherSession19, 22, TeacherSession22, 13, TeacherSession13
SID, Pxxxxxxxxx, N/A, ROSS, 141244, 10, 5, TeacherSession5, 9, TeacherSession9, 10, TeacherSession10, 11, TeacherSession11
FERN, Wxxxxx, N/A, ENGLER, 111225, 10, 37, TeacherSession37, 5, TeacherSession5, 40, TeacherSession40, 2, TeacherSession2
GEORGE, Bxxxxxxxxxx, N/A, REGAN, 169061, 10, 1, TeacherSession1, 3, TeacherSession3, 16, TeacherSession16, 5, TeacherSession5
CHASE, Kxxxxxx, N/A, KHLYABICH, 101587, 10, 8, TeacherSession8, 10, TeacherSession10, 15, TeacherSession15, 19, TeacherSession19
GENEVIEVE, Gxxxxxx, N/A, N BRAMLETT, 143739, 10, 1, TeacherSession1, 28, TeacherSession28, 22, TeacherSession22, 34, TeacherSession34
LAHNA, Bxxxxx, N/A, ROSS, 172601, 10, 12, TeacherSession12, 7, TeacherSession7, 1, TeacherSession1, 4, TeacherSession4
SHRIYA, Vxxxxx, N/A, ENGLER, 173779, 10, 41, TeacherSession41, 46, TeacherSession46, 32, TeacherSession32, 44, TeacherSession44
ALIVIA, Hxxxx, N/A, N BRAMLETT, 111298, 10, 43, TeacherSession43, 42, TeacherSession42, 44, TeacherSession44, 2, TeacherSession2
SAMUAL, Hxxxx, N/A, KELLY, 113003, 10, 10, TeacherSession10, 17, TeacherSession17, 39, TeacherSession39, 43, TeacherSession43
JORDYN, Jxxxx, N/A, N BRAMLETT, 123624, 10, 19, TeacherSession19, 35, TeacherSession35, 22, TeacherSession22, 44, TeacherSession44
MCKENNA, Fxxxx, N/A, N BRAMLETT, 183524, 10, 43, TeacherSession43, 37, TeacherSession37, 6, TeacherSession6, 1, TeacherSession1
JAMES, Pxxxx, N/A, KELLY, 152969, 10, 6, TeacherSession6, 15, TeacherSession15, 19, TeacherSession19, 13, TeacherSession13
PAYTON, Gxxxx, N/A, N BRAMLETT, 113750, 10, 34, TeacherSession34, 41, TeacherSession41, 14, TeacherSession14, 10, TeacherSession10
MAGGIE, Txxxxxxxx, N/A, ENGLER, 182069, 10, 19, TeacherSession19, 43, TeacherSession43, 44, TeacherSession44, 42, TeacherSession42
ANAIS, Hxxxxxx, N/A, KELLY, 133588, 10, 2, TeacherSession2, 1, TeacherSession1, 46, TeacherSession46, 41, TeacherSession41
PAULETTE, Pxxx, N/A, ROBBINS, 100291, 10, 18, TeacherSession18, 19, TeacherSession19, 20, TeacherSession20, 27, TeacherSession27
SOPHIE, Mxxxx, N/A, PAZDERAK, 134082, 10, 41, TeacherSession41, 35, TeacherSession35, 1, TeacherSession1, 31, TeacherSession31
JOSHUA, Hxxxxx, N/A, KELLY, 158297, 10, 12, TeacherSession12, 41, TeacherSession41, 3, TeacherSession3, 4, TeacherSession4
ROSE, Bxxxx, N/A, ROSS, 172765, 10, 40, TeacherSession40, 38, TeacherSession38, 19, TeacherSession19, 5, TeacherSession5
IAN, Bxxxxx xxxxxxx, N/A, REGAN, 140398, 10, 5, TeacherSession5, 13, TeacherSession13, 15, TeacherSession15, 16, TeacherSession16
ELEANOR, Axxxxxxx, N/A, ROSS, 125903, 10, 37, TeacherSession37, 35, TeacherSession35, 46, TeacherSession46, 32, TeacherSession32
MADISON, Sxx, N/A, ENGLER, 120694, 10, 37, TeacherSession37, 44, TeacherSession44, 15, TeacherSession15, 19, TeacherSession19
MASON, Hxxxx, N/A, REGAN, 146510, 10, 19, TeacherSession19, 23, TeacherSession23, 28, TeacherSession28, 34, TeacherSession34
NASH, Fxxxxxx, N/A, REGAN, 176257, 10, 19, TeacherSession19, 23, TeacherSession23, 28, TeacherSession28, 34, TeacherSession34
BARRY, Wxxxxx, N/A, ENGLER, 157460, 10, 45, TeacherSession45, 22, TeacherSession22, 46, TeacherSession46, 41, TeacherSession41
ADRIAH, Mxxxxxx, N/A, PAZDERAK, 189074, 10, 2, TeacherSession2, 1, TeacherSession1, 46, TeacherSession46, 29, TeacherSession29
JASPER, Bxxxxxxx, N/A, REGAN, 169215, 10, 41, TeacherSession41, 13, TeacherSession13, 3, TeacherSession3, 5, TeacherSession5
KAI, Cxxx, N/A, ROSS, 177193, 10, 9, TeacherSession9, 8, TeacherSession8, 10, TeacherSession10, 13, TeacherSession13
AUGUST, Txxxx, N/A, RADD, 101825, 10, 35, TeacherSession35, 29, TeacherSession29, 19, TeacherSession19, 4, TeacherSession4
MADDOX, Cxxxxx, N/A, ROSS, 110386, 10, 28, TeacherSession28, 1, TeacherSession1, 2, TeacherSession2, 45, TeacherSession45
YOUSUF, Bxxxxx, N/A, ROSS, 155494, 10, 17, TeacherSession17, 15, TeacherSession15, 13, TeacherSession13, 8, TeacherSession8
DANIEL SEE, Sxx, N/A, RADD, 199497, 10, 33, TeacherSession33, 37, TeacherSession37, 32, TeacherSession32, 42, TeacherSession42
MCOWEN, Mxxxxxx, N/A, KHLYABICH, 195029, 10, 45, TeacherSession45, 8, TeacherSession8, 1, TeacherSession1, 23, TeacherSession23
COLIN, Wxxxxxxxxxx, N/A, RADD, 175961, 10, 8, TeacherSession8, 7, TeacherSession7, 10, TeacherSession10, 12, TeacherSession12
EZRA, Yxxx, N/A, RADD, 142817, 10, 23, TeacherSession23, 29, TeacherSession29, 46, TeacherSession46, 22, TeacherSession22
SOFIA, Mxxxxxxx, N/A, PAZDERAK, 105919, 10, 10, TeacherSession10, 1, TeacherSession1, 41, TeacherSession41, 39, TeacherSession39
AIDEN, Bxxxxx, N/A, ROSS, 140384, 10, 16, TeacherSession16, 15, TeacherSession15, 3, TeacherSession3, 45, TeacherSession45
LANDEN, Axxxxxxxx, N/A, ROSS, 156134, 10, 10, TeacherSession10, 12, TeacherSession12, 11, TeacherSession11, 13, TeacherSession13
ISABELLA, Oxxxxxxx xxxxxx, N/A, ROBBINS, 103517, 10, 19, TeacherSession19, 45, TeacherSession45, 44, TeacherSession44, 18, TeacherSession18
LAUREN, Bxxxxx, N/A, ROSS, 152336, 10, 34, TeacherSession34, 19, TeacherSession19, 2, TeacherSession2, 43, TeacherSession43
LUKE, Cxxxxxx, N/A, ROSS, 112518, 10, 10, TeacherSession10, 23, TeacherSession23, 19, TeacherSession19, 42, TeacherSession42
DAMIAN, Mxxxxx, N/A, KELLY, 167319, 10, 9, TeacherSession9, 10, TeacherSession10, 8, TeacherSession8, 12, TeacherSession12
MADDON, Vxxxxxxxxx, N/A, ROSS, 176092, 10, 19, TeacherSession19, 23, TeacherSession23, 28, TeacherSession28, 34, TeacherSession34
PHANEESH, Lxxxxx, N/A, KHLYABICH, 161945, 10, 5, TeacherSession5, 46, TeacherSession46, 19, TeacherSession19, 12, TeacherSession12
CHARLES, Lxxxxxx, N/A, KELLY, 159995, 10, 1, TeacherSession1, 4, TeacherSession4, 8, TeacherSession8, 9, TeacherSession9
ARTEMIA, Txxxxxxxxxxxxx, N/A, RADD, 126099, 10, 33, TeacherSession33, 37, TeacherSession37, 46, TeacherSession46, 1, TeacherSession1
PRESLEY, Hxxxx, N/A, KELLY, 157980, 10, 35, TeacherSession35, 19, TeacherSession19, 29, TeacherSession29, 1, TeacherSession1
JULIAN, Wxxxxx, N/A, ENGLER, 104949, 10, 29, TeacherSession29, 31, TeacherSession31, 35, TeacherSession35, 46, TeacherSession46
DINO, Vxxxxxxxxx, N/A, KHLYABICH, 182700, 10, 12, TeacherSession12, 13, TeacherSession13, 19, TeacherSession19, 11, TeacherSession11
ZAHAR, Zxxxxx, N/A, RADD, 142416, 10, 12, TeacherSession12, 13, TeacherSession13, 32, TeacherSession32, 8, TeacherSession8
CHANCE, Wxxxxxxxxx, N/A, ENGLER, 141347, 10, 21, TeacherSession21, 23, TeacherSession23, 19, TeacherSession19, 24, TeacherSession24
ZAYDEN, Mxxxxx, N/A, KHLYABICH, 102228, 10, 19, TeacherSession19, 21, TeacherSession21, 22, TeacherSession22, 17, TeacherSession17
SAMANTHA, Kxxxxx, N/A, KHLYABICH, 113638, 10, 10, TeacherSession10, 4, TeacherSession4, 9, TeacherSession9, 18, TeacherSession18
IAN, Sxxxxx, N/A, ENGLER, 127946, 10, 18, TeacherSession18, 27, TeacherSession27, 19, TeacherSession19, 21, TeacherSession21
NATHAN, Kxxxxxxxxxxxx, N/A, KHLYABICH, 138752, 10, 15, TeacherSession15, 45, TeacherSession45, 11, TeacherSession11, 14, TeacherSession14
DAVID, Axxxxx, N/A, RADD, 107326, 10, 10, TeacherSession10, 17, TeacherSession17, 14, TeacherSession14, 15, TeacherSession15
GABRIEL, Wxxx, N/A, ENGLER, 189268, 10, 2, TeacherSession2, 1, TeacherSession1, 19, TeacherSession19, 29, TeacherSession29
LOGAN, Wxxxx, N/A, ENGLER, 187473, 10, 19, TeacherSession19, 21, TeacherSession21, 22, TeacherSession22, 4, TeacherSession4
SHAE, Mxxxxx, N/A, KHLYABICH, 130017, 10, 43, TeacherSession43, 19, TeacherSession19, 29, TeacherSession29, 42, TeacherSession42
ADELIA, Txxxxx, N/A, ENGLER, 156410, 10, 19, TeacherSession19, 4, TeacherSession4, 44, TeacherSession44, 2, TeacherSession2
CARINA, Wxxxxxx, N/A, ENGLER, 158559, 10, 34, TeacherSession34, 19, TeacherSession19, 28, TeacherSession28, 17, TeacherSession17
LUNA, Sxxxxxx, N/A, ENGLER, 179145, 10, 34, TeacherSession34, 19, TeacherSession19, 17, TeacherSession17, 45, TeacherSession45
AVA, Fxxxxxxxx xxxxx, N/A, REGAN, 178964, 10, 6, TeacherSession6, 12, TeacherSession12, 15, TeacherSession15, 17, TeacherSession17
BEN, Rxxxxxx, N/A, PAZDERAK, 148345, 10, 28, TeacherSession28, 1, TeacherSession1, 21, TeacherSession21, 19, TeacherSession19
HARPER, Mxxxxxxx, N/A, MILLBAND, 132219, 10, 17, TeacherSession17, 12, TeacherSession12, 7, TeacherSession7, 2, TeacherSession2
REDDIN, Mxxxxx, N/A, PAZDERAK, 149969, 10, 13, TeacherSession13, 12, TeacherSession12, 11, TeacherSession11, 26, TeacherSession26
LANDON, Pxxxxxxx, N/A, PAZDERAK, 159972, 10, 10, TeacherSession10, 6, TeacherSession6, 8, TeacherSession8, 13, TeacherSession13
ANNE, Bxxxxxx, N/A, REGAN, 115168, 10, 2, TeacherSession2, 32, TeacherSession32, 41, TeacherSession41, 39, TeacherSession39
ALMA, Wxxx, N/A, RADD, 109229, 10, 18, TeacherSession18, 19, TeacherSession19, 22, TeacherSession22, 28, TeacherSession28
ERNEST, Sxxxxx, N/A, ROBBINS, 163152, 10, 25, TeacherSession25, 10, TeacherSession10, 14, TeacherSession14, 20, TeacherSession20
RICHIE, Vxx xxxxxxxxx, N/A, ENGLER, 124450, 10, 1, TeacherSession1, 8, TeacherSession8, 5, TeacherSession5, 9, TeacherSession9
IVY, Mxxxxxxx, N/A, PAZDERAK, 183812, 10, 35, TeacherSession35, 34, TeacherSession34, 32, TeacherSession32, 4, TeacherSession4
LAINEY, Lxxx, N/A, KHLYABICH, 153787, 10, 22, TeacherSession22, 23, TeacherSession23, 21, TeacherSession21, 42, TeacherSession42
KIRIN, Rxxxxx, N/A, PAZDERAK, 190028, 10, 1, TeacherSession1, 2, TeacherSession2, 11, TeacherSession11, 18, TeacherSession18
ANITA, Mxxxxxxx, N/A, KHLYABICH, 102450, 10, 37, TeacherSession37, 32, TeacherSession32, 19, TeacherSession19, 33, TeacherSession33
SHARAYAH, Cxxxxxx, N/A, REGAN, 177331, 10, 35, TeacherSession35, 46, TeacherSession46, 30, TeacherSession30, 19, TeacherSession19
DEREK, Cxxxxxx, N/A, KHLYABICH, 178742, 10, 10, TeacherSession10, 8, TeacherSession8, 39, TeacherSession39, 9, TeacherSession9
EVAN, Zxxxx, N/A, ENGLER, 123543, 10, 3, TeacherSession3, 5, TeacherSession5, 1, TeacherSession1, 13, TeacherSession13
ESHAN, Vxxxxx, N/A, RADD, 161177, 10, 12, TeacherSession12, 7, TeacherSession7, 10, TeacherSession10, 19, TeacherSession19
MAXIMUS, Bxxxxx, N/A, REGAN, 109475, 10, 13, TeacherSession13, 15, TeacherSession15, 19, TeacherSession19, 21, TeacherSession21
SOFIA, Rxxx, N/A, ROBBINS, 145843, 10, 44, TeacherSession44, 2, TeacherSession2, 4, TeacherSession4, 14, TeacherSession14
NATHANIEL, Bxxxxx, N/A, PAZDERAK, 144640, 10, 1, TeacherSession1, 2, TeacherSession2, 36, TeacherSession36, 37, TeacherSession37
SAMIYA, Nxxxx, N/A, PAZDERAK, 168381, 10, 28, TeacherSession28, 32, TeacherSession32, 45, TeacherSession45, 35, TeacherSession35
JENNA, Nxxxxx, N/A, PAZDERAK, 175104, 10, 18, TeacherSession18, 19, TeacherSession19, 29, TeacherSession29, 31, TeacherSession31
JOSH, Uxxxxxxx, N/A, RADD, 133298, 10, 6, TeacherSession6, 10, TeacherSession10, 13, TeacherSession13, 19, TeacherSession19
GENEVIEVE, Vxxxxxx, N/A, RADD, 155163, 10, 33, TeacherSession33, 37, TeacherSession37, 34, TeacherSession34, 45, TeacherSession45
MEGHANA, Mxxxxxxxxx, N/A, KHLYABICH, 118613, 10, 14, TeacherSession14, 13, TeacherSession13, 17, TeacherSession17, 36, TeacherSession36
MASSIMO, Rxxxxxxxx, N/A, ROBBINS, 193633, 10, 4, TeacherSession4, 8, TeacherSession8, 11, TeacherSession11, 14, TeacherSession14
KYRA, Mxxxxx, N/A, KHLYABICH, 162541, 10, 6, TeacherSession6, 22, TeacherSession22, 2, TeacherSession2, 7, TeacherSession7
BROOKLYN, Lxx, N/A, KHLYABICH, 198465, 10, 42, TeacherSession42, 28, TeacherSession28, 30, TeacherSession30, 35, TeacherSession35
CASEY, Txxxxx, N/A, ENGLER, 147130, 10, 4, TeacherSession4, 13, TeacherSession13, 41, TeacherSession41, 19, TeacherSession19
ELIZA, Sxxxxx, N/A, ROBBINS, 179983, 10, 46, TeacherSession46, 28, TeacherSession28, 35, TeacherSession35, 5, TeacherSession5
EMMA, Gxxxxxxx xxxxxx, N/A, N BRAMLETT, 130395, 10, 37, TeacherSession37, 46, TeacherSession46, 45, TeacherSession45, 34, TeacherSession34
SOFIA, Sxxxxxx, N/A, KEMPFER, 127606, 9, 37, TeacherSession37, 44, TeacherSession44, 3, TeacherSession3, 46, TeacherSession46
LAURALAI, Gxxx, N/A, FOSTER, 197767, 9, 14, TeacherSession14, 5, TeacherSession5, 15, TeacherSession15, 41, TeacherSession41
DESTINY, Hxxxxxx, N/A, BARRETT, 127667, 9, 8, TeacherSession8, 10, TeacherSession10, 11, TeacherSession11, 44, TeacherSession44
NICHOLAS, Dx xxxx, N/A, BARRETT, 136892, 9, 45, TeacherSession45, 16, TeacherSession16, 5, TeacherSession5, 15, TeacherSession15
KAYLA, Mxxxxxxx, N/A, CAPRON, 103120, 9, 37, TeacherSession37, 43, TeacherSession43, 10, TeacherSession10, 28, TeacherSession28
CHAD, Mxxxxxx, N/A, SCOTT-RODGERS, 192747, 9, 45, TeacherSession45, 16, TeacherSession16, 15, TeacherSession15, 18, TeacherSession18
CAMILA, Axxxxxx, N/A, MILLER, 102827, 9, 2, TeacherSession2, 1, TeacherSession1, 44, TeacherSession44, 10, TeacherSession10
EDDIEL, Txxxxx xxxxxxx, N/A, FOSTER, 118175, 9, 9, TeacherSession9, 13, TeacherSession13, 12, TeacherSession12, 7, TeacherSession7
TAMRYN, Dxxx, N/A, BARRETT, 188400, 9, 37, TeacherSession37, 1, TeacherSession1, 44, TeacherSession44, 43, TeacherSession43
CATALINA, Wxxxxxx, N/A, KEMPFER, 183057, 9, 20, TeacherSession20, 1, TeacherSession1, 2, TeacherSession2, 15, TeacherSession15
SANTIAGO, Dxxxxxx xxxxxxx, N/A, MILLER, 115153, 9, 16, TeacherSession16, 23, TeacherSession23, 13, TeacherSession13, 44, TeacherSession44
PAIGE, Fxxxx, N/A, FOSTER, 175902, 9, 5, TeacherSession5, 12, TeacherSession12, 13, TeacherSession13, 6, TeacherSession6
NABEEL, Qxxxxx, N/A, MARTIN, 136715, 9, 17, TeacherSession17, 16, TeacherSession16, 22, TeacherSession22, 19, TeacherSession19
ZOI, Vxxxxxxxx, N/A, MARTIN, 163456, 9, 4, TeacherSession4, 20, TeacherSession20, 43, TeacherSession43, 19, TeacherSession19
DAVIS, Bxxxxxx, N/A, FOSTER, 198522, 9, 12, TeacherSession12, 13, TeacherSession13, 1, TeacherSession1, 19, TeacherSession19
SAWYER, Lxxxx, N/A, CAPRON, 142753, 9, 34, TeacherSession34, 41, TeacherSession41, 43, TeacherSession43, 25, TeacherSession25
LAELA, Nxxxx, N/A, MARTI, 141531, 9, 22, TeacherSession22, 44, TeacherSession44, 25, TeacherSession25, 19, TeacherSession19
CAROLINE, Oxxxxxxxx, N/A, MARTI, 172558, 9, 14, TeacherSession14, 15, TeacherSession15, 38, TeacherSession38, 37, TeacherSession37
JEREMY, Bxxxxxxxxxxxxxxxxx, N/A, BERINSTAIN-MUELLER, 194257, 9, 10, TeacherSession10, 11, TeacherSession11, 46, TeacherSession46, 9, TeacherSession9
RAHJIEK, Yxxxx, N/A, MARTIN, 107413, 9, 12, TeacherSession12, 7, TeacherSession7, 13, TeacherSession13, 11, TeacherSession11
AVA, Pxxxxxx, N/A, MARTI, 172281, 9, 38, TeacherSession38, 17, TeacherSession17, 34, TeacherSession34, 13, TeacherSession13
ANDREW, Gxxxxxxx, N/A, BARRETT, 117604, 9, 1, TeacherSession1, 8, TeacherSession8, 10, TeacherSession10, 18, TeacherSession18
ANISHA, Cxxxxxx, N/A, MILLER, 112366, 9, 13, TeacherSession13, 5, TeacherSession5, 41, TeacherSession41, 45, TeacherSession45
KAVISH, Pxxxx, N/A, MARTI, 191353, 9, 10, TeacherSession10, 6, TeacherSession6, 13, TeacherSession13, 7, TeacherSession7
JOSEPH, Pxxxxxx, N/A, MARTI, 162872, 9, 13, TeacherSession13, 1, TeacherSession1, 5, TeacherSession5, 3, TeacherSession3
JOCELYN, Gxxxx, N/A, BARRETT, 128097, 9, 18, TeacherSession18, 22, TeacherSession22, 37, TeacherSession37, 43, TeacherSession43
ELLIANA, Pxxxxx, N/A, MARTI, 107952, 9, 42, TeacherSession42, 44, TeacherSession44, 45, TeacherSession45, 35, TeacherSession35
ANDREW, Vxxxx, N/A, MARTI, 139659, 9, 10, TeacherSession10, 8, TeacherSession8, 9, TeacherSession9, 11, TeacherSession11
QUINN, Bxxxxx, N/A, MILLER, 167281, 9, 23, TeacherSession23, 21, TeacherSession21, 22, TeacherSession22, 25, TeacherSession25
LILIANA ( LIL ), Dxxxx, N/A, MARTIN, 136401, 9, 44, TeacherSession44, 22, TeacherSession22, 42, TeacherSession42, 17, TeacherSession17
LILY, Vx, N/A, MARTIN, 129114, 9, 4, TeacherSession4, 22, TeacherSession22, 23, TeacherSession23, 29, TeacherSession29
EMMA, Mxxx, N/A, MARTI, 110843, 9, 21, TeacherSession21, 23, TeacherSession23, 44, TeacherSession44, 42, TeacherSession42
JAHTEEN, Jxxxxxx, N/A, SCOTT-RODGERS, 150154, 9, 1, TeacherSession1, 2, TeacherSession2, 21, TeacherSession21, 9, TeacherSession9
EMMA, Nxxxx, N/A, MARTI, 183657, 9, 29, TeacherSession29, 16, TeacherSession16, 5, TeacherSession5, 43, TeacherSession43
DYLAN, Sxxxxx, N/A, KEMPFER, 125346, 9, 15, TeacherSession15, 12, TeacherSession12, 41, TeacherSession41, 18, TeacherSession18
SEBASTIAN, Lxxxxxxxxxxxxxx, N/A, FOSTER, 162891, 9, 7, TeacherSession7, 8, TeacherSession8, 11, TeacherSession11, 12, TeacherSession12
KAI, Mxxxx, N/A, MARTI, 123905, 9, 32, TeacherSession32, 37, TeacherSession37, 45, TeacherSession45, 46, TeacherSession46
PRESTON, Kxxxxxx, N/A, MARTIN, 151535, 9, 17, TeacherSession17, 16, TeacherSession16, 22, TeacherSession22, 1, TeacherSession1
TEEGAN, Sxxxxxx, N/A, DOWNIE, 108213, 9, 8, TeacherSession8, 1, TeacherSession1, 18, TeacherSession18, 38, TeacherSession38
JALDEYAH, Pxxxxxxx, N/A, DOWNIE, 112729, 9, 10, TeacherSession10, 40, TeacherSession40, 38, TeacherSession38, 45, TeacherSession45
ASHLEY, Wxxxxx, N/A, MARTIN, 115289, 9, 4, TeacherSession4, 22, TeacherSession22, 14, TeacherSession14, 31, TeacherSession31
TESHER, Cxxxxxxx, N/A, MILLER, 153997, 9, 38, TeacherSession38, 1, TeacherSession1, 7, TeacherSession7, 10, TeacherSession10
DOMINIC, Dxxxxxx, N/A, MARTIN, 118212, 9, 23, TeacherSession23, 21, TeacherSession21, 1, TeacherSession1, 2, TeacherSession2
LOGAN, Nxxxxxxx, N/A, MARTI, 110313, 9, 3, TeacherSession3, 8, TeacherSession8, 5, TeacherSession5, 46, TeacherSession46
ARTHUR, Kxxxxxxxx xxxxx xxxx xx xxxxxxxx, N/A, MILLER, 198779, 9, 5, TeacherSession5, 15, TeacherSession15, 13, TeacherSession13, 45, TeacherSession45
RONAN, Rxxxxx, N/A, KEMPFER, 168268, 9, 1, TeacherSession1, 4, TeacherSession4, 38, TeacherSession38, 37, TeacherSession37
SELAH, Vxxxxxx, N/A, MARTIN, 158141, 9, 33, TeacherSession33, 45, TeacherSession45, 34, TeacherSession34, 15, TeacherSession15
CARSYN, Hxxxxx, N/A, FOSTER, 123758, 9, 45, TeacherSession45, 44, TeacherSession44, 8, TeacherSession8, 13, TeacherSession13
HUKA, Txxxxxxx, N/A, DOWNIE, 157536, 9, 15, TeacherSession15, 14, TeacherSession14, 45, TeacherSession45, 42, TeacherSession42
EMMA, Lxxxxxxxxxx, N/A, CAPRON, 143168, 9, 22, TeacherSession22, 29, TeacherSession29, 35, TeacherSession35, 28, TeacherSession28
LUKE, Bxxxx, N/A, MILLER, 182627, 9, 15, TeacherSession15, 11, TeacherSession11, 8, TeacherSession8, 10, TeacherSession10
ALEX, Kxxxxx, N/A, CAPRON, 177801, 9, 10, TeacherSession10, 9, TeacherSession9, 5, TeacherSession5, 18, TeacherSession18
ELIZABETH, Gxxxxx, N/A, FOSTER, 115618, 9, 18, TeacherSession18, 5, TeacherSession5, 1, TeacherSession1, 2, TeacherSession2
BHAVAN, Gxxxx, N/A, MARTI, 188190, 9, 12, TeacherSession12, 16, TeacherSession16, 18, TeacherSession18, 45, TeacherSession45
EMMA, Bxxxx, N/A, MILLER, 183637, 9, 37, TeacherSession37, 36, TeacherSession36, 32, TeacherSession32, 28, TeacherSession28
RYAN, Vxxxxxxx, N/A, MARTIN, 141828, 9, 12, TeacherSession12, 13, TeacherSession13, 15, TeacherSession15, 17, TeacherSession17
GIA, Rxxx, N/A, MARTI, 177526, 9, 34, TeacherSession34, 37, TeacherSession37, 2, TeacherSession2, 26, TeacherSession26
DUNCAN, Sxxxxx, N/A, DOWNIE, 120470, 9, 10, TeacherSession10, 8, TeacherSession8, 9, TeacherSession9, 39, TeacherSession39
NIKITA, Sxxxx, N/A, KEMPFER, 170900, 9, 15, TeacherSession15, 28, TeacherSession28, 29, TeacherSession29, 45, TeacherSession45
MARLEY, Gxxxxx, N/A, MILLER, 172001, 9, 2, TeacherSession2, 4, TeacherSession4, 22, TeacherSession22, 28, TeacherSession28
CATHRYN, Cxxxxx, N/A, FOSTER, 149927, 9, 18, TeacherSession18, 29, TeacherSession29, 1, TeacherSession1, 2, TeacherSession2
VALERIE, Fxxxxxxx, N/A, MARTIN, 134720, 9, 41, TeacherSession41, 16, TeacherSession16, 34, TeacherSession34, 37, TeacherSession37
CULLEN, Rxxxxxx, N/A, KEMPFER, 125935, 9, 41, TeacherSession41, 38, TeacherSession38, 27, TeacherSession27, 21, TeacherSession21
DESMOND, Jxxxx, N/A, SCOTT-RODGERS, 143026, 9, 1, TeacherSession1, 3, TeacherSession3, 44, TeacherSession44, 14, TeacherSession14
JENNY, Hxxxx, N/A, CAPRON, 166732, 9, 30, TeacherSession30, 37, TeacherSession37, 10, TeacherSession10, 15, TeacherSession15
MICHAEL, Txxxxx, N/A, MARTIN, 129303, 9, 13, TeacherSession13, 11, TeacherSession11, 7, TeacherSession7, 41, TeacherSession41
BREVIN, Oxxxx, N/A, SCOTT-RODGERS, 193373, 9, 12, TeacherSession12, 11, TeacherSession11, 13, TeacherSession13, 4, TeacherSession4
MARCELL, Cxxxx, N/A, MILLER, 198641, 9, 42, TeacherSession42, 17, TeacherSession17, 22, TeacherSession22, 28, TeacherSession28
JACE, Cxxxx, N/A, MILLER, 144904, 9, 21, TeacherSession21, 24, TeacherSession24, 45, TeacherSession45, 8, TeacherSession8
BRAYDEN, Bxxxxx, N/A, MILLER, 181374, 9, 42, TeacherSession42, 17, TeacherSession17, 22, TeacherSession22, 28, TeacherSession28
AIDEN, Cxxxxxxxx, N/A, MILLER, 171604, 9, 28, TeacherSession28, 29, TeacherSession29, 33, TeacherSession33, 34, TeacherSession34
HENRY, Bxxxx, N/A, MILLER, 150452, 9, 34, TeacherSession34, 1, TeacherSession1, 7, TeacherSession7, 8, TeacherSession8
GAVIN, Jxxxxxx, N/A, CAPRON, 139210, 9, 22, TeacherSession22, 10, TeacherSession10, 8, TeacherSession8, 45, TeacherSession45
JACOB, Wxxxx, N/A, SCOTT-RODGERS, 160072, 9, 9, TeacherSession9, 10, TeacherSession10, 12, TeacherSession12, 13, TeacherSession13
KEEGAN, Sxxxxxx, N/A, DOWNIE, 185628, 9, 29, TeacherSession29, 31, TeacherSession31, 28, TeacherSession28, 23, TeacherSession23
TANA, Bxxxxxxx, N/A, FOSTER, 179838, 9, 1, TeacherSession1, 33, TeacherSession33, 15, TeacherSession15, 2, TeacherSession2
AVERY, Mxxxxxxxxx, N/A, CAPRON, 176458, 9, 16, TeacherSession16, 26, TeacherSession26, 15, TeacherSession15, 45, TeacherSession45
DANIEL, Sxxxxx, N/A, KEMPFER, 194784, 9, 24, TeacherSession24, 39, TeacherSession39, 11, TeacherSession11, 8, TeacherSession8
SONJA, Kxxxxxx, N/A, SCOTT-RODGERS, 173416, 9, 37, TeacherSession37, 9, TeacherSession9, 8, TeacherSession8, 46, TeacherSession46
BYRON, Bxxxxx, N/A, MARTIN, 164396, 9, 15, TeacherSession15, 18, TeacherSession18, 26, TeacherSession26, 36, TeacherSession36
OLIVER, Mxxxxx, N/A, CAPRON, 143100, 9, 4, TeacherSession4, 20, TeacherSession20, 22, TeacherSession22, 12, TeacherSession12
JAKE, Cxxxxx, N/A, MILLER, 186012, 9, 10, TeacherSession10, 6, TeacherSession6, 1, TeacherSession1, 15, TeacherSession15
BEYLA, Nxxx, N/A, SCOTT-RODGERS, 192410, 9, 14, TeacherSession14, 35, TeacherSession35, 45, TeacherSession45, 22, TeacherSession22
MICHAEL, Yxxx, N/A, MARTIN, 167732, 9, 37, TeacherSession37, 28, TeacherSession28, 46, TeacherSession46, 5, TeacherSession5
SUN, Hxx, N/A, KEMPFER, 183238, 9, 46, TeacherSession46, 41, TeacherSession41, 34, TeacherSession34, 16, TeacherSession16
HAEDYN, Lxxxxxxx, N/A, SCOTT-RODGERS, 182423, 9, 30, TeacherSession30, 43, TeacherSession43, 29, TeacherSession29, 16, TeacherSession16
DIYOR, Axxxxxxx, N/A, MILLER, 152026, 9, 18, TeacherSession18, 20, TeacherSession20, 22, TeacherSession22, 15, TeacherSession15
ELLA, Sxxxxx, N/A, DOWNIE, 127245, 9, 44, TeacherSession44, 28, TeacherSession28, 37, TeacherSession37, 18, TeacherSession18
MEGHAN, Hxxxxxx, N/A, CAPRON, 138675, 9, 13, TeacherSession13, 3, TeacherSession3, 15, TeacherSession15, 17, TeacherSession17
NOAH, Mxxxxx, N/A, SCOTT-RODGERS, 169520, 9, 12, TeacherSession12, 11, TeacherSession11, 6, TeacherSession6, 10, TeacherSession10
CECELIA, Cxxxxxx, N/A, BARRETT, 183792, 9, 2, TeacherSession2, 30, TeacherSession30, 34, TeacherSession34, 37, TeacherSession37
AVA, Fxxxxx, N/A, BARRETT, 190567, 9, 2, TeacherSession2, 30, TeacherSession30, 34, TeacherSession34, 37, TeacherSession37
LONDON, Kxxxxxxx, N/A, SCOTT-RODGERS, 193330, 9, 40, TeacherSession40, 9, TeacherSession9, 10, TeacherSession10, 8, TeacherSession8
JAY, Jxxxxxx, N/A, SCOTT-RODGERS, 111007, 9, 15, TeacherSession15, 8, TeacherSession8, 5, TeacherSession5, 2, TeacherSession2
AMABEL, Txxxxxx, N/A, KEMPFER, 104369, 9, 43, TeacherSession43, 4, TeacherSession4, 13, TeacherSession13, 21, TeacherSession21
SIMEON, Hxxxx, N/A, BARRETT, 143533, 9, 29, TeacherSession29, 30, TeacherSession30, 18, TeacherSession18, 32, TeacherSession32
ANA, Jxxxxxx, N/A, CAPRON, 148890, 9, 41, TeacherSession41, 6, TeacherSession6, 32, TeacherSession32, 36, TeacherSession36
CLAUDIA, Mxxxxxx, N/A, SCOTT-RODGERS, 186394, 9, 11, TeacherSession11, 13, TeacherSession13, 41, TeacherSession41, 43, TeacherSession43
TALIA, Wxxxx, N/A, KEMPFER, 168980, 9, 35, TeacherSession35, 17, TeacherSession17, 32, TeacherSession32, 14, TeacherSession14
MAX, Wxxx, N/A, KEMPFER, 121268, 9, 38, TeacherSession38, 32, TeacherSession32, 29, TeacherSession29, 22, TeacherSession22
JACOB, Vxxxxxxxxxxx, N/A, KEMPFER, 195651, 9, 38, TeacherSession38, 32, TeacherSession32, 29, TeacherSession29, 22, TeacherSession22
IZZY, Dxxxxxxxxx, N/A, KEMPFER, 177762, 9, 12, TeacherSession12, 10, TeacherSession10, 13, TeacherSession13, 37, TeacherSession37
AVA, Bxxxxxx, N/A, MILLER, 191686, 9, 2, TeacherSession2, 1, TeacherSession1, 15, TeacherSession15, 43, TeacherSession43
ELLIANA, Fxxxx, N/A, BARRETT, 141644, 9, 34, TeacherSession34, 2, TeacherSession2, 46, TeacherSession46, 14, TeacherSession14
MASON, Zxx, N/A, MARTIN, 142047, 9, 13, TeacherSession13, 1, TeacherSession1, 11, TeacherSession11, 23, TeacherSession23
WYATT, Dxxxxxx, N/A, MARTIN, 140764, 9, 13, TeacherSession13, 1, TeacherSession1, 3, TeacherSession3, 15, TeacherSession15
ERIC, Nxxxx, N/A, SCOTT-RODGERS, 165004, 9, 8, TeacherSession8, 9, TeacherSession9, 40, TeacherSession40, 16, TeacherSession16
ANEEQA, Exxxxxxxx, N/A, BARRETT, 137363, 9, 6, TeacherSession6, 2, TeacherSession2, 4, TeacherSession4, 1, TeacherSession1
ADDISON, Sxxxx, N/A, KEMPFER, 197965, 9, 15, TeacherSession15, 18, TeacherSession18, 45, TeacherSession45, 36, TeacherSession36
HOPE, Rxxxxx, N/A, FOSTER, 141656, 9, 10, TeacherSession10, 13, TeacherSession13, 5, TeacherSession5, 8, TeacherSession8
ZACHARY, Hxxxxxxxxx, N/A, CAPRON, 117969, 9, 40, TeacherSession40, 10, TeacherSession10, 8, TeacherSession8, 13, TeacherSession13
